药材,古籍,别名,性味归经,功用,药材简介,药剂1,药剂2,药剂3,药剂4,药剂5,药剂6,药剂7,药剂8,药剂9,药剂10,用法用量,注意事项
石决明,《名医别录》,真珠母、鳆鱼甲、九孔螺、千里光,咸，寒。归肝经。,平肝潜阳，清肝明目。,石决明，中药名。为鲍科鲍属动物杂色鲍、皱纹盘鲍、羊鲍、澳洲鲍、耳鲍或白鲍的贝壳。具有平肝潜阳，清肝明目，收敛止血，制酸止痛的功效。生石决明主要用于肝阳上亢，头晕目眩，惊痫抽搐，目赤翳障，视物昏花，骨蒸劳热，淋证；煅石决明用于疮疡久溃不敛，胃酸过多的胃脘疼痛，外伤出血。,,,,,,,,,,,脾胃虚寒者慎服，消化不良、胃酸缺乏者禁服。,
牡蛎,《神农本草经》,生牡蛎、蛎蛤、古贲、左顾牡蛎、蚝,咸，微寒。归肝、胆、肾经。,潜阳补阴，重镇安神，软坚散结，收敛固涩，制酸止痛。,牡蛎，中药名。为牡蛎科牡蛎属动物长牡蛎、大连湾牡蛎或近江牡蛎等的贝壳。具有平肝潜阳，收敛固涩，软坚散结，镇惊安神的功效。用于治疗心神不安，惊悸失眠；肝阳上亢，头目眩晕；痰核，瘿瘤，瘰疬，癥瘕积聚；自汗、盗汗、遗精、滑精、遗尿、尿频、崩漏、带下等滑脱诸证；胃痛泛酸；百合病；外伤出血；疮痈肿毒，疮疡湿疹。,,,,,,,,,,,煎服，9～30g，先煎。潜阳补阴、重镇安神、软坚散结生用，收敛固涩、制酸止痛煅用。,1.咸寒质重，有重镇软坚之功。身体虚弱，脾胃虚寒症见少气、乏力、食少、自汗、恶寒胃冷、手足发凉者禁大量内服或单味药久服。 2.肾气虚或肾阳虚证见面色能白、形寒肢冷、气短喘逆、尿颇而清、腰膝酸软、阳痿滑精者忌大量内服或单味药久服。 3.有收敛固涩的作用，外感表证以及表证未解者不宜服用；便秘者忌用。 4.内服牡蛎可能会导致过敏性腹泻，因此对牡蛎过敏者忌服。 5.所含的碳酸钙有中和胃酸的作用，因此萎缩性胃炎患者忌单味药大量服用。 6.含有多种矿物质，肾炎、肾功能不全者不宜大量长期服用，以免引起矿物质在体内蓄积从而加重病情。
珍珠母,《本草图经》,珠牡、珠母、明珠母,咸，寒。归肝、心经。,平肝潜阳，安神定惊，明目退翳。,珍珠母，中药名。为蚌科冠蚌属动物褐纹冠蚌、帆蚌属动物三角帆蚌或珍珠贝科母贝属动物合浦珠母贝的贝壳。具有平肝潜阳，清肝明目，镇心安神的功效。主治肝阳上亢、头晕目眩，目赤肿痛、视物昏花，惊悸失眠、心神不宁，癫痫，惊风抽搐，吐血、衄血；外用于湿疮瘙痒，疮疡久不收口，口疮等。煅后研末吞服，治疗胃酸过多，胃脘疼痛。,珍珠母配龙齿,珍珠母配地黄,珍珠母丸,安眠汤,降压平片,冠心安口服液,安神补心丸,牛黄消炎灵胶囊,,,珍珠母煎汁内服时，需要打碎，先煎，成人每天的常规用量为10~25克。 或研末，每次1.5~3克；或入丸、散剂。外用适量，研末调涂。 除消食药（应该在饭后及时服药）、镇静安神药（临睡前服用）等药物之外，一般药物无论饭前还是饭后服，服药与进食都应间隔1小时左右，以免影响药效的发挥与食物的消化。,珍珠母咸寒，属于沉降之品，故脾胃虚寒、气虚下陷者慎用；孕妇慎用。
紫贝齿,《新修本草》,紫贝、文贝、紫贝子、南蛇牙齿、狗支螺海巴,咸，平。归肝经。,平肝潜阳，镇惊安神，清肝明目。,紫贝齿，中药名。为宝贝科动物蛇首眼球贝、山猫宝贝或绶贝等的贝壳。具有平肝潜阳，镇惊安神，清肝明目的功效。主治肝阳上亢，头晕目眩，惊痫抽搐，惊悸失眠，目赤翳障，目昏眼花等。,,,,,,,,,,,脾胃虚弱者慎用。,
刺蒺藜,茨、蒺藜、蒺藜子、旁通、屈人、止行、豺羽、升推、即藜、白蒺藜子、白蒺藜、杜蒺藜、土蒺藜、白蒺藜、旱草、三角蒺藜、三角刺、八角刺、蒺骨子、野菱角、地菱、硬蒺黎、蒺黎蓇葖,味苦、辛，性平；归肝、肺经；有小毒,平肝潜阳，疏肝解郁，祛风明目，祛风止痒，散结消瘀。,刺蒺藜，中药名。为蒺藜科蒺藜属植物蒺藜和大花蒺藜的果实。具有平肝潜阳，疏肝解郁，祛风明目，祛风止痒，散结消瘀的功效。主要用于治疗肝阳上亢之头晕目眩，头痛烦躁，失眠多梦等；肝气郁结之胸胁胀痛，乳汁不通，可单用本品研末服或配伍其他通乳药物；风热上攻，目赤翳障；风疹瘙痒，白癜风；积聚、瘰疬、乳岩等。,内服：煎汤，6-9g，或入丸、散。外用：水 煎洗；或研末调敷。,,,,,,,,,,,辛散，血虚气弱及孕妇慎服。,
代赭石,味苦，性寒；归肝、心经,平肝潜阳，重镇降逆，凉血止血。,代赭石，中药名。为氧化类刚玉族矿物赤铁矿的矿石。具有平肝潜阳，重镇降逆，凉血止血的功效。主治肝阳上亢，头晕目眩，呕吐，呃逆，噫气，气逆喘息，血热吐衄，崩漏。开矿采集。,内服：煎服，10-30g；宜打碎先煎。入丸、散，每次1-3g。外用：适量。降逆、平肝宜生用，止血宜煅用。,虚寒证及孕妇慎服。,,,,,,,,,,,1、代赭石配旋覆花：代赭石平肝泄热，镇逆降气，以降为主；旋覆花消痰平喘，降气止呕，宣肺利水，以升为主。二药配伍，一宣一降，共奏镇逆降压，镇静止痛，下气止呕，化痰消痞之功。适用于治疗上实之喘满，及胃气上逆之呕吐、呃逆、噫气。 2、代赭石配石膏：代赭石味苦，性凉，质重坠，有镇逆气、止呕吐之力；石膏味辛性寒，主清胃热。二者相使为用，共奏清胃降火镇逆之功。胃热亢盛之证，非石膏之大寒则其热不除，火气冲逆之热，代赭石之重坠则其逆莫制。适用于胃火上冲，循经上炎而见于呕吐呃逆，牙龈肿痛，口气臭秽，口渴心烦等。 3、代赭石配白芍：代赭石平肝降逆止血；白芍敛阴养血柔肝。二药配伍，平肝柔肝，养血止血。适用于肝阳上亢，眩晕耳鸣，血热妄行，吐血，衄血等。 4、代赭石配牛膝：代赭石重镇潜降；牛膝功善下行。二药相配，有平肝降逆的功效。适用于肝阳上亢，气血上逆的眩晕，脑转耳鸣，目胀头痛等。,
天麻,《神农本草经》,鬼督邮、水洋芋、明天麻、冬彭,甘，平。归肝经。,息风止痉，平抑肝阳，祛风通络。,天麻，中药名。为兰科天麻属植物天麻的干燥块茎。具有息风止痉，平抑肝阳，祛风通络的功效。主治肝风内动，惊痫抽搐，眩晕，头痛，肢体麻木，手足不遂，风湿痹痛等。以冬季茎花未出土时采集之冬麻质重效佳，花茎出土所采之春麻次之。,天麻配钩藤,天麻配川芎,天麻配全蝎、僵蚕,天麻钩藤饮,半夏白术天麻汤,天麻散,天麻丸,全天麻胶囊,,,天麻煎汁内服时，成人每天的常规用量为3~10克。 研末冲服，成人每天的常规用量为1~1.5克；或入丸、散。 无论饭前还是饭后服，服药与进食都应间隔1小时左右，以免影响药物的吸收和药效的发挥。,1.性偏温，善治肝风兼夹痰湿的患者。由于阴虚火旺、血虚血燥、实热内炽而致肝风内动或肝阳上亢者不宜单味药服用。气血两虚者不宜单味药服用。 2.有明显的抑制中枢神经的作用，老年人和婴幼儿不宜长期大量服用。 3.可以减慢心率，降低血压。心动过缓、低血压患者不宜大量长期服用，以免加重病情。 4.具有增强免疫功能的作用，有变态反应性疾病者不宜大量长期服用。 5.孕妇不宜单味药大量长期服用。
钩藤,《名医别录》,双钩藤、鹰爪风、吊风根、金钩草、倒挂刺,甘，凉。归肝、心包经。,息风定惊，清热平肝。,钩藤，中药名。为茜草科钩藤属植物钩藤、大叶钩藤、毛钩藤、华钩藤或无柄果钩藤的带钩茎枝。具有清热平肝，息风止痉的功效。主治肝风内动，惊痫抽搐；肝火上攻或肝阳上亢之头痛眩晕等；风热表证之头痛目赤，斑疹透发不畅等。,钩藤配蝉蜕,钩藤配牛膝,钩藤配紫草,钩藤饮,羚角钩藤汤,钩藤饮子,钩藤散,清脑降压片,,,钩藤煎汁内服时，成人每天的常规用量为3～12克。 本品有效成分钩藤碱加热后容易破坏，因此不适合久煎。应先煎煮其他药材，后放入钩藤，且煎煮一般不超过20分钟。 或入丸、散剂。 除消食药（应该在饭后及时服药）、镇静安神药（临睡前服用）等药物之外，一般药物无论饭前还是饭后服，服药与进食都应间隔1小时左右，以免影响药效的发挥与食物的消化。,1.甘寒，有一定的清热作用。脾胃虚寒肾阳虚者，以及外感风寒，内伤生冷等证不宜大量长期服用。 2.有明显的抑制中枢神经的作用。昏迷病人禁用；老年人和婴幼儿不宜长期大量服用。 3.可以减慢心率，降低血压。心动过缓、低血压患者不宜大量长期服用，以免加重病情。 4.有兴奋子宫平滑肌的作用，孕妇及先兆流产者慎用。 5.高血压病人服用钩藤总碱治疗量时，副作用轻微，个别岀现心动过缓、头晕、皮疹、月经量减少等，但停药后可自行消除。
牛黄,《神农本草经》,犀黄、各一旺,苦，凉。归心、肝经。,凉肝息风，清心豁痰，开窍醒神，清热解毒。,牛黄，中药名。为牛科野牛属动物牛干燥的胆结石。具有化痰开窍，凉肝息风，清热解毒的功效。主治热病神昏，小儿惊风，癫痫，口舌生疮，咽喉肿痛，牙痛，痈疽疔毒。宰杀牛后得到牛黄。,牛黄配珍珠,牛黄配水牛角,牛黄配朱砂,安宫牛黄丸,牛黄清心丸,牛黄丸,牛黄散,安宫牛黄丸（胶囊、散）,,,牛黄入丸、散剂时，成人每次的常规用量为0.15～0.35克。 外用时适量，研末撒或调敷患处。 除消食药（应该在饭后及时服药）、镇静安神药（临睡前服用）等药物以外，一般药物无论饭前还是饭后服，服药与进食都应间隔1小时左右，以免影响药效的发挥与食物的消化。,1.《本草经集注》：“人参为之使。恶龙骨、地黄、龙胆、蜚蠊。畏牛膝。” 2.《药性论》：“恶常山。畏干漆。” 3.《品汇精要》：“妊妇勿服。” 4.《本草经疏》：“伤乳作泻，脾胃虚寒者不当用。” 5.孕妇慎服。
全蝎,《蜀本草》,全虫、蝎子,辛，平；有毒。归肝经。,息风镇痉，通络止痛，攻毒散结。,全蝎，中药名。为钳蝎科钳蝎属动物东亚钳蝎的干燥体。具有息风镇痉，攻毒散结，通络止痛的功效。主治各种原因引起的惊风，痉挛抽搐；疮疡肿毒，瘰疬结核，脱疽，乳房痈肿；风湿顽痹，筋脉拘挛；顽固性偏正头痛；并能够治疗多种肿瘤。,全蝎配蜈蚣,全蝎配钩藤,全蝎散,牵正散,全蝎丸,全蝎膏,羊痫疯丸,复方牵正膏,,,全蝎煎汤内服时，成人每天的常规用量为3～6克，内服还可以研末吞服，每次0.6～1克，外用适量，可以研末掺，熬膏或油浸涂敷。 除消食药（应该在饭后及时服药）、镇静安神药（临睡前服用）等药物之外，一般药物无论饭前还是饭后服，服药与进食都应间隔1小时左右，以免影响药效的发挥与食物的消化。,血虚生风者及孕妇禁服。
地龙,《神农本草经》,蚯蚓、广地龙,咸，寒。归肝、脾、膀胱经。,清热定惊，通络，平喘，利尿。,地龙，中药名。为钜蚓科环毛蚓属动物参环毛蚓、通俗环毛蚓、威廉环毛蚓或栉盲环毛蚓的干燥全体。具有清热息风，通络，平喘，利尿，降压的功效。主治高热惊痫，癫狂；气虚血滞，半身不遂；痹证，关节疼痛，屈伸不利；肺热哮喘；热结膀胱小便不利或尿闭不通；眩晕，头痛；跌打损伤；痈肿疮毒等。,地龙配天麻,地龙配夏枯草,地龙配附子,地龙散,小金丹,补阳还五汤,清肺消炎丸,消栓口服液,,,地龙煎汁内服时，成人每天的常规用量为5～10克。 可以入丸、散剂。研末吞服，每次1～2克。 本品味腥，内服容易引起呕吐，配少量陈皮一起煎煮，或炒香之后研末装胶囊服用，可减少此反应。 鲜地龙用量为10～20克。 外用适量，可以将鲜地龙捣烂取汁涂抹或外敷，研末外撒或调匀后涂于患处。 本品多饭后服用，无论饭前还是饭后服，服药与进食都应间隔0.5-1小时，以免影响药物的吸收和药效的发挥。,脾胃虚弱或无实热者忌用。
羚羊角,《神农本草经》,高鼻羚羊角,咸，寒。归肝、心经。,平肝息风，清肝明目，清热解毒。,羚羊角，中药材。为牛科羚羊属动物赛加羚羊雄兽的角。具有平肝息风，清肝明目，清热解毒的功效。主治肝风内动，惊痫抽搐；肝阳上亢，头晕目眩；肝火上炎，目赤头痛；温热病壮热神昏，热毒发斑；痈肿疮毒，血热毒盛及风湿热痹，肺热咳喘，百日咳等。,,,,,,,,,,,性寒，脾虚慢惊者忌用；过敏体质者慎用。,
蜈蚣,《神农本草经》,天龙,辛，温；有毒。归肝经。,息风镇痉，通络止痛，攻毒散结。,蜈蚣，中药名。为蜈蚣科蜈蚣属动物少棘巨蜈蚣的干燥体。具有息风镇痉，攻毒散结，通络止痛的功效。主治多种原因导致的痉挛抽搐；疮疡肿毒，瘰疬结核；风湿顽痹，关节疼痛；顽固性偏正头痛；毒蛇咬伤。在清明节前后捕捉较好。,,,,,,,,,,,煎服，3～5g。外用适量。,本品有毒，用量不宜过大。孕妇忌用。
珍珠,《日华子本草》,真朱、真珠、蚌珠、珠子,甘、咸，寒。归心、肝经。,安神定惊，明目消翳，解毒生肌，润肤祛斑。,珍珠，中药名。为珍珠贝科珠母贝属动物合浦母贝、珠母贝、大珠母贝、长耳珠母贝或蚌科帆蚌属动物三角帆蚌、冠蚌属动物褶纹冠蚌、无齿蚌属动物背角无齿蚌等贝壳中外套膜受刺激形成的珍珠。具有安神定惊，明目去翳，解毒生肌的功效。主治心神不宁，心悸失眠，多梦健忘；高热烦躁、神昏抽搐之急慢惊风，癫痫抽搐；目赤翳障，视物不清；诸疮肿毒，溃久不敛；梦遗，滑精，白浊；皮肤色斑；跌打损伤，金疮伤；肾虚耳聋，五心烦热，盗汗；脾虚积热，脘腹胀满，气逆呕恶等。,,,,,,,,,,,1.须研成极细粉末应用，“否则伤人脏腑，外掺肌肉作疼”（《本草求真》）。 2.重坠之品，孕妇不宜；病不由火热者勿用（《本草经疏》）。 3.疮毒者内毒未净，遂用珍珠“以生肌，转难收口”（《本草新编》）。,
僵蚕,僵蚕、天虫、僵虫、白僵虫,味咸、辛，性平；归肝、肺、胃经,息风止痉，祛风止痛，化痰散结。,僵蚕，中药名。为蚕蛾科家蚕蛾属昆虫家蚕4-5龄的幼虫在未吐丝前，感染或人工接种白僵菌而致死的干燥体。具有息风止痉，祛风止痛，化痰散结的功效。主治急慢惊风、癫痫、破伤风等岀现的惊痫抽搐；风中经络，口眼歪斜；风热头痛，目赤，咽痛，风疹瘙痒；瘰疬痰核等。,僵蚕煎汁内服时，成人每天的常规用量为5～10克。 研末吞服时，成人每次的常规用量为1～1.5克。 僵蚕更宜入丸、散剂。外用适量，研末调敷。 除消食药（应该在饭后及时服药）、镇静安神药（临睡前服用）等药物之外，一般药物无论饭前还是饭后服，服药与进食都应间隔1小时左右，以免影响药效的发挥与食物的消化。,,,,,,,,,,,属于血虚而有风寒客邪者忌用。血小板减少、凝血机制障碍、有出血倾向者以及肝昏迷患者慎用。,
石菖蒲,《神农本草经》,菖蒲、山菖蒲、药菖蒲、金钱蒲、菖蒲叶、水剑草、香菖蒲,辛、苦，温。归心、胃经,开窍豁痰，醒神益智，化湿和胃。,石菖蒲，中药名。为天南星科菖蒲属植物石菖蒲．的干燥根茎，具有开窍醒神，化湿和胃，宁神益志的功效。主治痰蒙清窍，神志昏迷；湿阻中焦，脘腹痞满，胀闷疼痛；噤口痢；健忘，失眠，耳鸣，耳聋。,石菖蒲配香附,石菖蒲配郁金,石菖蒲配厚朴,石菖蒲配佩兰,定痫丸,桑螵蛸散,甘露消毒丹,萆薢分清饮,,,石菖蒲煎汁内服时，成人每天的常规用量为3～10克，鲜品用量加倍；或入丸散，每次1～2克。 外用时适量，水煎外洗或研末调敷。 除消食药（应该在饭后及时服药）、镇静安神药（临睡前服用）等药物之外，一般药物无论饭前还是饭后服，服药与进食都应间隔1小时左右，以免影响药效的发挥与食物的消化。,1.性温，凡外感风寒或温热，热实内炽，阴虚火旺、血虚血热等，忌单味服用。 2.辛香偏燥而散，有伤津耗液之弊，阴血不足者忌用。症见烦躁多汗，咳嗽，吐血，精滑者不宜单味长期服用。 3.有抑制中枢神经的作用，老人，小孩、婴幼儿不宜长期服用。 4.可以抑制肠道平滑肌的收缩，促进消化液分泌，胃溃疡患者不宜长期服用。
冰片,《新修本草》,片脑、桔片、艾片、龙脑香、梅花冰片、羯布罗香、梅花脑、冰片脑、梅冰、龙脑,辛、苦，微寒。归心、脾，肺经。,开窍醒神，清热止痛。,冰片，中药名。为龙脑香科龙脑香属植物龙脑香树脂加工品，或龙脑香树的树干、树枝切碎，经蒸馏冷却而得的结晶。具有开窍醒神，清热止痛的功效。主治闭证神昏，目赤肿痛，喉痹口疮，疮疡肿痛，疮溃不敛，水火烫伤。,,,,,,,,,,,0.15～0.3g，入丸散用。外用研粉点敷患处。,1.性寒，凡外感风寒，内伤生冷，脾胃阳虚，肾阳虚衰等证不宜长期服用。 2.味辛，有耗气截液之弊，凡由于血虚而阳气上亢所致昏厥者忌用。因肝肾亏虚而眼目昏暗者不宜入点眼药。 3.冰片容易透过血脑屏障而进入大脑，对中枢神经系统有一定的影响，婴幼儿，老年人不宜长期服用。 4.冰片对子宫有明显的兴奋作用，引起堕胎，孕妇忌用。
麝香,《神农本草经》,当门子、麝脐香、四味臭,辛，温。归心、脾经。,开窍醒神，活血通经，消肿止痛。,麝香，中药名。为鹿科麝属动物林麝、马麝或原麝成熟雄体香囊中的干燥分泌物。具有开窍醒神，活血通经，消肿止痛的功效。主治闭证神昏，疮疡肿毒，瘰疬痰核，咽喉肿痛，血瘀经闭，癥瘕，心腹暴痛，头痛，跌打损伤，风寒湿痹，难产，死胎，胞衣不下。捕捉麝之后可取得麝香。,麝香配苏合香,麝香配木香,麝香配川芎,安宫牛黄丸,紫雪,至宝丹,苏合香丸,紫金锭,,,麝香内服时入丸、散剂，不入煎剂，成人每天常规用量为0.03～0.1克。 外用适量，研末掺、调敷或入膏药中敷贴。 除消食药（应该在饭后及时服药）、镇静安神药（临睡前服用）等药物之外，一般药物无论饭前还是饭后服，服药与进食都应间隔1小时左右，以免影响药效的发挥与食物的消化。,虚脱证禁用；本品无论内服或外用均能堕胎，故孕妇禁用。
苏合香,《名医别录》,苏合油、流动苏合香,辛，温。归心、脾经。,开窍醒神，辟秽，止痛。,苏合香，中药名。为金缕梅科苏合香属植物苏合香树的树干渗出的香树脂。具有开窍醒神，辟秽，止痛的功效。主治寒闭神昏，胸腹冷痛，满闷剂冻疮等。,苏合香配冰片,苏合香丸,冠心苏合丸,,,,,,,,苏合香推荐做成丸散服用，成人每天的常规用量为0.3～1克，也可以研末服用。 外用时适量，溶于乙醇或制成软膏、搽剂涂敷。 除消食药（应该在饭后及时服药）、镇静安神药（临睡前服用）等药物之外，一般药物无论饭前还是饭后服，服药与进食都应间隔1小时左右，以免影响药效的发挥与食物的消化。,1.性温，凡外感风热或温热、实热内炽，阴虚火旺、血虚血热等证，忌单味药服用。 2.辛香偏燥而散，有伤津耗液之弊，阴血不足者禁用。症见烦躁汗多、咳嗽、吐血、精滑者不宜单味药长期服用。 3.辛香走窜，行气力强，年老体弱等气虚证者不宜长期服用。 4.有抗血小板聚集和抗血栓形成等作用，出血性疾病患者忌用。 5.孕妇不宜长期服用。
甘草,生甘草、甜草根、红甘草、粉甘草、粉草、皮草、棒草,甘，平。归心、肺、脾、胃经。,补脾益气，清热解毒，祛痰止咳，缓急止痛，调和诸药。,甘草，中药名。为豆科甘草属植物植物甘草、胀果甘草或光果甘草的干燥根和根茎。具有益气补中，润肺止咳，清热解毒，缓急止痛，调和药性的功效。主治脾虚倦怠，心虚悸动，咳嗽气喘，痈疽喉痹，药食中毒，脘腹、四肢挛急疼痛等。,甘草煎汁内服时，成人每天的常规用量为2～10克。 干品研末，入丸、散，6～10克。 生用，适合清热解毒；蜜炙用，适合益气复脉，补脾和胃，缓急止痛，经过蜜炙可增强补益心脾之气和祛痰止咳的作用。 除消食药（应该在饭后及时服药）、镇静安神药（临睡前服用）等药物之外，一般药物无论饭前还是饭后服，服药与进食都应间隔1小时左右，以免影响药效的发挥与食物的消化。,,,,,,,,,,,1.甘草味甘，能助湿壅气、令人中满，故湿盛而胸腹胀满及呕吐者忌服。 2.长期大量服用本品，可岀现浮肿、血压升高、钠潴留血钾降低、四肢无力、痉挛麻木、头晕、头痛等不良反应，故不宜大量服用。 3.各种水肿、肾病、高血压、低血钾，充血性心力衰竭等患者，均宜慎用。 4.不宜与海藻、京大戟、红大戟、甘遂、芫花同用。,
人参,《神农本草经》,圆参、黄参、棒槌、人衔、鬼盖、神草、土精、地精、海腴、人葠,甘、微苦，微温。归脾、肺、心、肾经。,大补元气，复脉固脱，补脾益肺，生津养血，安神益智。,人参，中药名。为五加科人参属植物人参的根及根茎。具有大补元气，补脾益肺，生津，安神益智的功效。主治气虚欲脱，脉微欲绝，脾气不足，中气下陷，肺虚喘咳，气短乏力，津伤口渴，虚热消渴，失眠健忘，心悸怔忡，血虚萎黄，阳痿宫冷等。5年以上才能开挖，注意保护根部。挖完之后要把植株重新种好。 生晒参主根呈纺锤形或圆柱形，长3-15，直径1-2，表面灰黄色，上部或全体有疏浅断续的粗横纹及明显的纵皱，下部有支根2-3条，并着生多数细长的须根，根茎芦头长1-4，直径03-15，多拘挛而弯曲，具不定根和稀疏的凹窝状茎痕芦碗，质较硬，断面淡黄色，显粉性，气微香而特异，味微苦，甘。,人参配麦冬、五味子,人参配蛤蚧,人参配白术,人参配远志,人参配熟地黄,参附汤,生脉散,四君子汤,参苓白术散,,人参煎汁内服时，成人每天的常规用量为3～9克，挽救虚脱可用15～30克，宜采用文火另煎兑服的方法。 人参还可研粉吞服，一次2克，一日2次。或熬膏、泡酒，或入丸散剂。 除消食药（应该在饭后及时服药）、镇静安神药（临睡前服用）等药物之外，一般药物无论饭前还是饭后服，服药与进食都应间隔1小时左右，以免影响药效的发挥与食物的消化。,1、实证、热证及湿热内盛正气不虚者禁服。不宜与茶同服。 2、十八反：藜芦反人参
山药,《神农本草经》,怀参、藷藇、署预、薯蓣、山芋、诸署、署豫、玉延、修脆、几草、山藷、延草、王芋,甘，平。归脾、肺、肾经。,益气养阴，补脾肺肾，涩精止带。,山药，中药名。为薯蓣科薯蓣属植物薯蓣的根茎。具有益气养阴，补脾肺肾，固精止带的功效。主治脾虚食少，倦怠乏力，便溏泄泻，肺虚喘咳，肾虚遗精，带下尿频，内热消渴等。,,,,,,,,,,,煎服，10～30g。麸炒山药补脾健胃，用于脾虚食少，泄泻便溏，白带过多。,湿盛中满或有实邪、积滞者禁服。
太子参,《中国药用植物志》,孩儿参、童参、双批七、四叶参、米参,甘、微苦，平。归脾、肺经。,益气健脾，生津润肺。,,太子参配石斛,太子参配黄芪,太子参配山药,太子参配北沙参,太子参配青蒿,桂枝参耆煎,健胃消食片,肾衰宁胶囊,,,太子参煎汁内服时，成人每天的常规用量为9~30克。 多饭前服用，无论饭前还是饭后服，服药与进食都应间隔0.5～1小时，以免影响药物吸收和药效的发挥。,脾寒肠滑久泄者忌用。
