药材,古籍,别名,性味归经,功用,药材简介,药剂1,药剂2,药剂3,药剂4,药剂5,药剂6,药剂7,药剂8,药剂9,药剂10,用法用量,注意事项
牵牛子,草金铃、金铃、黑牵牛、白牵牛、黑丑、白丑、二丑、丑牛,味苦、性寒；归肺、肾、大肠经；有毒,泻下逐水，去积杀虫。,牵牛子，中药名。为旋花科牵牛属植物牵牛或圆叶牵牛的干燥成熟种子。具有泻下逐水，去积杀虫的功效。主治水肿，膨胀，痰饮喘咳，虫积腹痛。果实完全成熟时采收。,孕妇忌用。不宜与巴豆、巴豆霜同用。,,,,,,,,,,,,1、治水肿：牵牛子末之，水服方寸七，日一，以小便利为度。（《千金方》） 2、治停饮肿满：黑牵牛头末四两，茴香一两（炒），或加木香一两，上为细末，以生姜自然汁调一二钱，临卧服。（《偶门事亲）禹功散） 3、治腰脚湿气疼痛：黑牵牛，大黄各二两，白术一两。上为细末，漓水丸如桐子大。每服三十丸，食前生姜汤下。如要快利，加至百丸。（《世传神效名方）牛黄白术丸） 4、治气筑奔冲不可忍：黑牵牛半两，槟榔一分（锉）。上为末，舒服一大钱，浓煎紫苏生姜汤调下。（《卫生家宝方》牵牛丸） 5、治惊疳，啼哭烦躁，面赤痰喘：黑丑头末一两，雄黄一两，天竺黄二两。为末，饭丸粟米大。每岁五丸，人粥内与食，（《婴童类萃》） 6、治大肠风秘，维热结涩牵牛子（黑色。微炒，捣取其中粉）一两，别以麸炒去皮、尖桃仁（末）半两。以熟蜜和丸如梧桐子，温水服三二十丸，不可久服。（《本草衍义》） 7、治一切所伤，心腹痞满刺痛，积滞不消：黑牵牛二两（炒，末），五灵脂（炒），香附（炒）各一网，上为末，酷糊丸如小豆大，每服三十丸，食后生姜汤下。（《卫生宝鉴》消滞丸） 8、治小儿心腹气胀，喘粗，不下食：牵牛子（微炒）、木香，马兜铃各一份，上件药，捣粗罗为散，每服一钱，以水一小盏，煎至五分，去渣，不计时候，量儿大小，以意加减。（《圣惠方》） 9、治小儿疳证：木香二饯半，黑牵牛半两（生用）。为细末，而糊为丸，如绿豆大，三岁儿三十丸，用米饭汤送卜，不拘时服。（《奇效良方》分气丸） 10、治一切虫积：牵牛子二两（炒，研为末），槟榔一两，使君子肉五十个（微炒）。俱为末，每服二钱，砂糖调下，小儿减半，（《永类钤方》） 11、治冷气流注，腰疼不能俯仰：延胡索二两，破故纸（炒）二两，黑牵牛子三两（炒）。上为细末，煨大蒜研，搜丸如梧榈子大，每服三十丸，煎葱须盐汤送下，食前服。（《杨氏家藏方》牵牛丸） 12、治肾气作痛：黑牵牛（炒熟）、白牵牛（炒熟），等分。上为末，每服挑三钱匕，猪腰一副，薄切开缝，人川椒五十粒，苗香一百粒，以牵牛末遍掺人肾中，线系湿纸数裹煨，香熟，出火气。灯后空心嚼吃，好酒送下，少顷就枕，天明取下恶物即愈。（《直指方》腰子散。 13、治一切痈疽发背，无名肿毒：牵牛黑、白者各一合。用布包槌碎，好酒一碗，煎至八分，碟一夜。温热服，以大便出脓血为度。（《鲁府禁方》黑白散） 14、治风热赤眼：黑丑仁为末，调葱白汤，敷患处。（《泉州本草》）
川乌,《神农本草经》,鹅儿花、铁花、五毒,辛、苦，热。归心、肝、肾、脾经。生川乌有大毒，制川乌有毒。,祛风除湿，温经止痛。,川乌，正名为乌头，别名：鹅儿花、铁花、五毒；被子植物门，毛茛科，乌头属。英文名，生于山地草坡或灌丛中。栽培于平地肥沃的砂质土壤，主要栽培于四川。分布于长江中下游，北至秦岭和山东东部，南至广西北部。,制川乌配麻黄,制川乌配当归,制川乌配制白附子,制川乌配生石膏,川乌散,乌头汤,小活络丹,风湿骨痛丸（胶囊）,,,川乌煎汁内服时，一般用炮制品，成人每天的常规用量为1.5～3克，宜先煎、久煎，煎至入口无麻辣感为度。或入丸、散。 外用时适量，研末调敷。 除消食药（应该在饭后及时服药）、镇静安神药（临睡前服用）等药物之外，一般药物无论饭前还是饭后服，服药与进食都应间隔1小时左右，以免影响药效的发挥与食物的消化。,生品内服宜慎，酒煎服、酒浸易致中毒。孕妇忌用。制川乌孕妇慎用。不宜与半夏、川贝母、浙贝母、平贝母、伊贝母、湖北贝母、瓜蒌、瓜蒌皮、瓜蒌子、天花粉、白及、白蔹同用。
威灵仙,《新修本草》,铁脚威灵仙、铁角威灵仙、铁脚灵仙、铁脚铁线莲、铁耙头等,辛、咸，温。归膀胱经。,祛风湿，通经络，止痛，消骨骾。,威灵仙，中药名。为毛茛科铁线莲属植物威灵仙、棉团铁线莲或东北铁线莲的干燥根和根茎。具有祛风湿，通络止痛，消骨鲠的功效。主治风湿痹证、骨鲠咽喉、跌打伤痛、头痛、牙痛、胃脘痛，及痰饮、噎膈、妇女癥瘕积块、乳房肿块等。,威灵仙配羌活,威灵仙配桑寄生,威灵仙配防己,威灵仙配苍术,威灵丸,威灵仙方,风湿片,骨刺消痛液,,,威灵仙煎汁内服时，成人每天的常规用量为6～10克。 用于消散骨鲠，可用至30克。 或入丸、散剂。外用适量。,本品辛散走窜，气血虚弱者慎服。
徐长卿,《神农本草经》,寮刁竹、逍遥竹、遥竹逍、瑶山竹、了刁竹、对节莲、竹叶细辛、铜锣草、一枝香、英雄草,辛，温。归肝、胃经。,祛风除湿，止痛，止痒。,,徐长卿配威灵仙,徐长卿配当归,徐长卿散,徐长卿汤,骨刺消痛片,复方南星止痛膏,风湿定片（胶囊）,骨刺丸,,,徐长卿煎汁内服时，成人每天的常规用量为3~12克，本品气味芳香，不能久煎，需后下。 外用适量。也可以煎水外洗，或者捣碎外敷，或者煎水口含。 除消食药（应该在饭后及时服药）、镇静安神药（临睡前服用）等药物之外，一般药物无论饭前还是饭后服，服药与进食都应间隔1小时左右，以免影响药效的发挥与食物的消化。,体弱者慎服。
独活,《神农本草经》,长生草、独滑,辛、苦，微温。归肾、膀胱经。,祛风除湿，通痹止痛，解表。,独活，中药名。为伞形科当归属植物重齿当归的干燥根。具有祛风湿，止痛，解表的功效。主治风寒湿痹，风寒挟湿表证，少阴头痛，皮肤瘙痒。,独活配桑寄生,独活配细辛,独活配防风,独活配苍术,独活寄生汤,荆防败毒散,三痹汤,独活细辛汤,,,独活煎汁内服时，成人每天的常规用量为3～10克。浸酒或入丸、散。 外用适量，煎汤洗。 除消食药（应该在饭后及时服药）、镇静安神药（临睡前服用）等药物以外，一般药物无论饭前还是饭后服，服药与进食都应间隔1小时左右，以免影响药效的发挥与食物的消化。,内服量不宜过大，阴虚血燥者慎服。
青风藤,《本草纲目》,大风藤、吹风散、青藤,苦、辛，平。归肝、脾经。,祛风湿，通经络，利小便,青风藤，中药名。为防己科防己属植物青藤和毛青藤的干燥藤茎。具有祛风湿，通经络，利小便的功效。用于风湿痹痛，关节肿胀，麻痹瘙痒。,,,,,,,,,,,使用剂量个体差异较大，不良反应的产生与过敏机制有关，临床使用时应定期作白细胞的检查。,
木瓜,《名医别录》,贴梗海棠、铁脚梨、川木瓜,酸，温。归肝、脾经。,祛风湿，舒筋活络，和胃化湿。,木瓜，中药名。为蔷薇科木瓜属植物皱皮木瓜的近成熟果实。具有舒筋活络，和胃化湿的功效。主治风湿痹痛，肢体酸重，筋脉拘挛，吐泻转筋，脚气水肿。可随熟随采。,木瓜配吴茱萸,木瓜配秦艽,木瓜配五加皮,实脾散,鸡鸣散,六和汤,颈通颗粒,金乌骨通胶囊,,,木瓜煎汁内服时，成人每天的常规用量为6～9克。 除消食药（应该在饭后及时服药）、镇静安神药（临睡前服用）等药物之外，一般药物无论饭前还是饭后服，服药与进食都应间隔1小时左右，以免影响药效的发挥与食物的消化。,《本草经疏》：下部腰膝无力，由于精血虚、真阴不足者，不宜用；伤食脾胃未虚、积滞多者，不宜用。
路路通,《本草纲目拾遗》,枫香果、九孔子、狼目,苦，平。归肝、肾经。,祛风活络，利水，通经。,路路通，中药名。为金缕梅科枫香属植物枫香树的干燥成熟果序。具有祛风活络，利水，通经的功效。主治风湿痹痛，中风半身不遂，跌打损伤，水肿，经行不畅，经闭，乳少，乳汁不通，风疹瘙痒。,路路通配益母草,路路通配茯苓,路路通配伸筋草,和肝益肾饮,滋乳汤,抗风湿液,耳聋通窍丸,生乳片,,,路路通煎汁内服时，成人每天的常规用量为5～10克。或研末服用。 外用适量，可研末撒于患处，或燃烧出烟，嗅其气味。 除消食药（应该在饭后及时服药）、镇静安神药（临睡前服用）等药物之外，一般药物无论饭前还是饭后服，服药与进食都应间隔1小时左右，以免影响药效的发挥与食物的消化。,月经过多及孕妇忌服。
乌梢蛇,《药性论》,乌蛇、乌风蛇、剑脊蛇、黑风蛇、黄风蛇、剑脊乌梢蛇、南蛇、乌蛇肉,甘，平。归肝经。,祛风，通络，止痉。,乌蛇，中药名。为游蛇科乌梢属动物乌梢蛇的干燥体。具有祛风，通络，止痉的功效。主治风湿顽痹，中风半身不遂，小儿惊风，破伤风，麻风，疥癣，瘰疬，恶疮。,,,,,,,,,,,血虚生风者慎服；忌犯铁器。,
蕲蛇,《雷公炮炙论》,大白花蛇、棋盘蛇、五步蛇、百步蛇,甘、咸，温；有毒。归肝经。,祛风，通络，止痉。,蕲蛇，中药名。为蝰科蝮蛇属动物尖吻蝮蛇的干燥体。具有祛风，通络，止痉的功效。主治风湿顽痹，中风半身不遂，小儿惊风，破伤风，麻风，疥癣。,,,,,,,,,,,阴虚内热者忌服。,
伸筋草,《本草拾遗》,石松、狮子草、狮子尾,微苦、辛，温。归肝、脾、肾经。,祛风除湿，舒筋活络。,伸筋草，中药名。为石松科属植物石松的干燥全草。夏、秋二季茎叶茂盛时采收，除去杂质，晒干。具有祛风除湿，舒筋活络的功效。用于关节酸痛，屈伸不利。,伸筋草配木瓜,伸筋草配桑枝,伸筋草配鸡血藤,关节风痛丸,消肿痛醋膏,关节解痛膏,疏痛安涂膜剂,,,,伸筋草煎汁内服时，成人每天的常规用量为6～15克。 伸筋草也可以外用，需适量。 除消食药（应该在饭后服药）、镇静安神药（临睡前服用）等药物以外，一般药物无论饭前还是饭后服，服药与进食都应间隔1小时左右，以免影响药效的发挥与食物的消化。,孕妇及出血过多者忌服。
丁公藤,《中国药典》,麻辣子、包公藤、石楠藤,辛，温；有小毒。归肝、脾、胃经。,祛风除湿，消肿止痛。,丁公藤，中药名。为旋花科丁公藤属植物丁公藤或光叶丁公藤的干燥藤茎。具有祛风除湿，消肿止痛的功效。主治风湿痹痛，半身不遂，跌打肿痛。,,,,,,,,,,,本品有毒，有强烈发汗作用，虚弱者慎服。,
海风藤,《本草再新》,爬岩香、老藤、岩胡椒,辛、苦，微温。归肝经。,祛风湿，通经络，止痹痛。,海风藤，中药名。为胡椒科属植物风藤的干燥藤茎。具有祛风湿，通络止痛的功效。主治风寒湿痹，跌打损伤，咳喘胸闷，痰多气急。,海风藤配桂枝,海风藤配威灵仙,海风藤配鸡血藤,舒筋汤,遇仙膏,散风活络丸（浓缩丸）,天和追风膏（外用）,豹骨活络丸,,,海风藤煎汁内服时，成人每天的常规用量为6～12克。 外用适量。 除消食药（应该在饭后及时服药）、镇静安神药（临睡前服用）等药物以外，一般药物无论饭前还是饭后服，服药与进食都应间隔1小时左右，以免影响药效的发挥与食物的消化。,孕妇慎服。
蚕沙,《本草纲目》,原蚕屎、晚蚕沙、蚕砂,甘、辛，温。归肝、脾、胃经。,祛风除湿，和胃化湿。,蚕沙，中药名。为蚕蛾科家蚕属动物家蚕蛾幼虫的粪便。具有祛风除湿，和胃化湿的功效。主治风寒湿痹、半身不遂、吐泻转筋，风疹、湿疹瘙痒。,,,,,,,,,,,蚕沙煎汁内服时，成人每天的常规用量为5～15克。 蚕沙煎汁内服时，应用布包好再进行煎煮。 蚕沙也可以入丸剂、散剂。 蚕沙外用适量，可以炒热后热敷在皮肤表面，也可以煎水后擦洗患处，或研末后敷在患处。 除消食药（应该在饭后及时服药）、镇静安神药（临睡前服用）等药物之外，一般药物无论饭前还是饭后服，服药与进食都应间隔1小时左右，以免影响药效的发挥与食物的消化。,不宜用于肝肾亏损，血虚失于荣养的腰膝酸软冷痛。
油松节,味苦、辛，性温。肝、肾经,有祛风除湿，通络止痛的作用。,油松节，中药名。为松科植物油松或马尾松的干燥瘤状节或分枝节。全年均可采收，锯取后阴干。 本品呈扁圆节段状或不规则的块状，长短粗细不一。外表面黄棕色、灰棕色或红棕色，有时带有棕色至黑棕色油斑，或有残存的栓皮。质坚硬。横截面木部淡棕色，心材色稍深，可见明显的年轮环纹，显油性；髓部小，淡黄棕色。纵断面具纵直或扭曲纹理。有松节油香气，味微苦辛。 主要分部于华北及吉林、辽宁、甘肃、陕西、青海、河南、湖北、四川。,阴虚血燥者慎用。,,,,,,,,,,,,,
昆明山海棠,火把花、断肠草、紫金皮、紫金藤、雷公藤、掉毛草、胖关藤、红毛山藤,味苦、辛，性温；归肝、脾、肾经；有大毒,祛风湿，祛瘀通络，续筋接骨。,昆明山海棠，中药名。为卫矛科雷公藤属植物昆明山海棠的根或全株。具有祛风湿，祛瘀通络，续筋接骨的功效。主治风湿痹证，跌打损伤，骨折，产后出血过多，癌肿，顽癣等。,昆明山海棠煎汁内服时，成人每天的常规用量为6～15克，适宜先煎或酒浸服。 外用时适量，研末调敷，或煎水涂，或鲜品捣敷。 除消食药（应该在饭后及时服药）、镇静安神药（临睡前服用）等药物之外，一般药物无论饭前还是饭后服，服药与进食都应间隔1小时左右，以免影响药效的发挥与食物的消化。,,,,,,,,,,,孕妇及体弱者忌服。,
防己,《神农本草经》,木防己,苦，寒。归膀胱、肺经。,祛风湿，止痛，利水消肿。,防己，中药名。为防己科千金藤属植物粉防己的干燥根。习称汉防己。具有祛风湿，止痛，利水消肿的功效。,防己配木瓜,防己配桂枝,防己配黄芪,防己配茯苓,防己配白术,防己黄芪汤,宣痹汤,防己茯苓汤,,,防己煎汁内服时，成人每天的常规用量为5～10克。​或入丸、散。 除消食药（应该在饭后及时服药）、镇静安神药（临睡前服用）等药物之外，一般药物无论饭前还是饭后服，服药与进食都应间隔1小时左右，以免影响药效的发挥与食物的消化。,本品苦寒较甚，不宜大量使用，以免损伤胃气。食欲不振及阴虚无湿热者忌用。
秦艽,《神农本草经》,秦胶、秦纠、左秦艽,辛、苦，平。归胃、肝、胆经。,祛风湿，清湿热，舒筋络，止痹痛，退虚热。,秦艽，中药名。为龙胆科龙胆属植物秦艽、麻花秦艽、粗茎秦艽或小秦艽的干燥根。具有祛风湿，通络止痛，退虚热，清湿热的功效。主治中风不遂，骨蒸潮热，疳积发热，湿热黄疸。,秦艽配鳖甲,秦艽配地骨皮,秦艽配络石藤,秦艽配天麻,秦艽配茵陈,大秦艽汤,秦艽鳖甲散,秦艽散,秦艽天麻汤,,秦艽煎汁内服时，成人每天的常规用量为3～10克。 可浸酒或入丸、散。外用适量，研末撒。 除消食药（应该在饭后及时服药）、镇静安神药（临睡前服用）等药物之外，一般药物无论饭前还是饭后服，服药与进食都应间隔1小时左右，以免影响药效的发挥与食物的消化。,久痛虚羸，溲多、便滑者慎服。
桑枝,《本草图经》,桑条,微苦，平。归肝经,祛风湿，利关节。,桑枝，中药名。为桑科桑属植物桑的干燥嫩枝。具有祛风湿，利关节的功效。主治风湿痹证，肩臂、关节酸痛麻木。,,,,,,,,,,,桑枝煎汁内服时，成人每天的常规用量为9～15克。 外用适量，煎水洗。 除消食药（应该在饭后及时服药）、镇静安神药（临睡前服用）等药物之外，一般药物无论饭前还是饭后服，服药与进食都应间隔1小时左右，以免影响药效的发挥与食物的消化。,
络石藤,《神农本草经》,明石、悬石、云珠、云丹、络石等,苦，微寒。归心、肝、肾经。,祛风通络，凉血消肿。,络石藤，中药名。为夹竹桃科络石属植物络石的干燥带叶藤茎。具有祛风通络，凉血消肿的功效。主治风湿热痹，喉痹，痈肿，跌扑损伤。,,,,,,,,,,,阳虚畏寒，大便溏薄者禁服。,
丝瓜络,《本草纲目》,丝瓜网、丝瓜壳、瓜络,甘，平。归肺、胃、肝经。,祛风，通络，活血，下乳。,,丝瓜络配桑枝,丝瓜络配瓜萎,丝瓜络配蒲公英,补肾壮阳汤,滑膜炎颗粒,驱风液,通络生乳糖浆,,,,丝瓜络煎汁内服时，成人每天的常规用量为5～12克。 外用适量，把丝瓜络直接放在火中烧至外皮轻微炭化焦黑，里面焦黄为止，保持药物里面原有的性味，研磨调敷，每次1.5～3克。 除消食药（应该在饭后及时服药）、镇静安神药（临睡前服用）等药物之外，一般药物无论饭前还是饭后服，服药与进食都应间隔1小时左右，以免影响药效的发挥与食物的消化。,脾胃虚寒者少用丝瓜络。
老鹳草,《救荒本草》,五叶草、老官草、五瓣花、老贯草、天罡草、五叶联、破铜钱、老鸹筋、贯筋、五齿粑、老鸹嘴、鹌子嘴。,辛、苦，平。归肝、肾、脾经。,祛风湿，通经络，止泻痢，清热解毒。,老鹳草，中药名。为牻牛儿苗科牻牛儿苗属植物牻牛儿苗及老鹳草属植物老鹳草或野老鹳草的干燥地上部分。具有祛风湿，通经络，清热毒，止泻痢的功效。主治风湿痹证，泄泻，痢疾，疮疡。,老鹳草配威灵仙,老鹳草配黄柏,风湿痹痛药酒,祛风止痛片,经带宁胶囊,老鹳草软膏,肾康颗粒,,,,老鹳草煎汁内服时，成人每天的常规用量为9～15克。 本品还可以浸酒、熬膏。 外用适量，可捣烂加酒炒热外敷或制成软膏涂敷于患处。 除消食药（应该在饭后及时服药）、镇静安神药（临睡前服用）等药物之外，一般药物无论饭前还是饭后服，服药与进食都应间隔1小时左右，以免影响药效的发挥与食物的消化。,脾胃虚寒者忌用。
豨莶草,《新修本草》,珠草、肥猪草、粘不扎,辛、苦，寒。归肝、肾经。,祛风湿，利关节，解毒。,豨莶草，中药名。为菊科豨莶草属植物豨莶或腺梗豨莶的干燥地上部分。具有祛风湿，利关节，解毒的功效。主治风湿痹痛，中风半身不遂，风疹，湿疮，疮痈。,豨莶草配威灵仙,豨莶草配臭梧桐叶,豨莶草配当归,稀莶散,豨莶丸,关节风痛丸,风湿片,,,,豨莶草煎汁内服时，成人每天的常规用量为9～12克。外用适量。 除消食药（应该在饭后及时服药）、镇静安神药（临睡前服用）等药物之外，一般药物无论饭前还是饭后服，服药与进食都应间隔1小时左右，以免影响药效的发挥与食物的消化。,1.掌握药物适应证。阴血不足者忌服。孕妇及小儿，免疫力低下者慎用。 2.严格掌握剂量，依据病情及个体剂量化，禁止超剂量应用。豨莶草的用量应依病情变化、个体差异而定，但最大量不可超过12克，且不宜久服。 3.需长期使用豨莶草及其制剂时，应在医师指导下用药，以确保用药安全、有效。
穿山龙,《东北药用植物志》,穿地龙、金刚骨、鸡骨头,甘、苦，温。归肝、肾、肺经。,祛风除湿，舒筋通络，活血止痛，止咳平喘。,穿山龙，中药名。为薯蓣科薯蓣属植物穿龙薯蓣的干燥根茎。具有祛风湿，活血通络，清肺化痰的功效。主治风湿痹证，痰热咳喘，胸痹，跌打损伤，痈肿疮毒等。,,,,,,,,,,,粉碎加工后，注意防护，以免发生过敏反应。,
臭梧桐,《采药书》,臭桐、八角梧桐、海州常山,辛、苦、甘，凉。归肝经。,祛风湿，通经络，平肝。,臭梧桐，中药名。为马鞭草科大青属植物海州常山的嫩枝及叶。具有祛风湿，通经络，平肝的功效。主治风湿痹证，风疹，湿疮，头痛眩晕。,,,,,,,,,,,煎服，5～15g；用于高血压病不宜久煎。研末服，每次3g。外用适量。,臭梧桐经高热煎煮后，降压作用减弱。
海桐皮,《开宝本草 》,楤木、鹊不踏、鸟不宿,苦、辛，平。归肝经。,祛风湿，通络止痛，杀虫止痒。,海桐皮，中药名。为豆科刺桐属植物刺桐、乔木刺桐的干皮或根皮。具有祛风湿，通络止痛，杀虫止痒的功效。主治风寒湿痹，腰膝酸痛，脚气，痛风，皮肤疥癣，湿疹，以及湿热泻痢等。,,,,,,,,,,,血虚者不宜服。,
雷公藤,《中国药植志》,藤根、黄药、水莽草、断肠草、菜虫药、南蛇根、三棱花、旱禾花、黄藤木、红药、红紫根、黄藤草。,苦、辛，寒；有大毒。归肝、肾经。,祛风除湿，活血通络，消肿止痛，杀虫解毒。,,,,,,,,,,,,雷公藤煎汁内服时，成人每天的常规用量为1～3克，适合先煎。 外用适量，可以研粉或捣烂敷，或制成酊剂、软膏涂擦。 除消食药（应该在饭后及时服药）、镇静安神药（临睡前服用）等药物之外，一般药物无论饭前还是饭后服，服药与进食都应间隔1小时左右，以免影响药效的发挥与食物的消化。,内脏有器质性病变及白细胞减少者慎服；孕妇忌服。
千年健,《本草纲目拾遗》,千年见、年见,苦、辛，温。归肝、肾经。,祛风湿，强筋骨。,千年健，中药名。为天南星科千年健属植物千年健的干燥根茎。具有祛风湿，壮筋骨的功效。主治风寒湿痹。,,,,,,,,,,,阴虚内热者慎服。,
狗脊,《神农本草经》,金毛狗脊、猴毛头、金狗脊,苦、甘，温。归肝、肾经,祛风湿，补肝肾，强腰膝。,狗脊，中药名。为蚌壳蕨科金毛狗蕨属植物金毛狗脊的干燥根茎。具有祛风湿，补肝肾，强腰膝的功效。主治风湿痹证，腰膝酸软，下肢无力，遗尿，白带过多。,,,,,,,,,,,煎服，6～12g。,肾虚有热，小便不利，或短涩黄赤，口苦舌干者，均禁服。
五加皮,《神农本草经》,南五加皮、五谷皮,辛、苦，温。归肝、肾经。,祛风除湿，补益肝肾，强筋壮骨，利水消肿。,五加皮，中药名。为五加科五加属植物细柱五加的干燥根皮。具有祛风湿，补肝肾，强筋骨，利水的功效。主治风湿痹证，筋骨痿软，小儿行迟，体虚乏力，水肿，脚气。,五加皮配威灵仙,五加皮配杜仲,五加皮配茯苓皮,加减地仙丹,五加皮丸,腰椎痹痛丸,精制五加皮酒,追风强肾酒,,,五加皮煎汁内服时，成人每天的常规用量为5～10克。 五加皮可酒浸或入丸、散剂服用；外用时适量，可煎水熏洗或研末外敷于患处。 除消食药（应该在饭后及时服药）、镇静安神药（临睡前服用）等药物之外，一般药物无论饭前还是饭后服，服药与进食都应间隔1小时左右，以免影响药效的发挥与食物的消化。,阴虚火旺者慎服。
