药材,古籍,别名,性味归经,功用,药材简介,药剂1,药剂2,药剂3,药剂4,药剂5,药剂6,药剂7,药剂8,药剂9,药剂10,用法用量,注意事项
白及,《神农本草经》,白芨、甘根、连及草、臼根、白给,苦、甘、涩，微寒。归肺、胃、肝经。,收敛止血，消肿生肌。,白及，中药名。为兰科白及属植物白及的块茎。具有收敛止血，消肿生肌的功效。主治出血证，痈肿疮疡，手足皲裂，水火烫伤。,,,,,,,,,,,煎服，6～15g；研末吞服3～6g。外用适量。,“十八反”中明言“乌头反白及”，故乌头（川乌，草乌）与白及一般不宜配伍。并反附子。
仙鹤草,《图经本草》,龙芽草、脱力草、狼牙草,苦、涩，平。归心、肝经。,收敛止血，截疟，止痢，解毒，补虚。,仙鹤草，中药名。为蔷薇科龙芽草属植物龙芽草的干燥地上部分。具有收敛止血，止痢，截疟，补虚的功效。主治各种出血证，久泻久痢，寒热疟疾，气血亏虚脱力劳伤等。,仙鹤草配生地黄,仙鹤草配大枣,维血宁颗粒（合剂）,达肺草,溃疡胶囊,腹安冲剂,养血安神片（糖浆、丸）,,,,仙鹤草煎汁内服时，成人每天的常规用量为6~12克。 外用适量，捣敷；或熬膏涂敷。或入丸、散。 除消食药（应该在饭后及时服药）、镇静安神药（临睡前服用）等药物之外，一般药物无论饭前还是饭后服，服药与进食都应间隔1小时左右，以免影响药效的发挥与食物的消化 。,服后可引起心悸、颜面充血与潮红等现象。
紫珠叶,苦、涩，凉。归肝、肺、胃经,凉血收敛止血，散瘀解毒消肿。,紫珠叶，中药名。为马鞭草科植物杜虹花的干燥叶。夏、秋二季枝叶茂盛时采摘，干燥。具有凉血收敛止血，散瘀解毒消肿之功效。常用于衄血，咯血，吐血，便血，崩漏，外伤出血，热毒疮疡，水火烫伤。,,夏、秋二季枝叶茂盛时采收，除去杂质，洗净，切段，干燥。,,,,,,,,,,,,
血余炭,血余、发髲、乱发、发灰子、头发、人发灰,味苦，性平；归肝、胃经,收敛止血，化瘀，利尿。,血余炭，中药名。为人科健康人头发制成的炭化物。具有化瘀止血，养阴利尿的功效。主治瘀血阻滞的出血证及小便不利等。开矿采集。,胃弱者慎服。,,,,,,,,,,,,1、治咳血、吐血，常与花蕊石、三七同用，如化血丹（《医学衷中参西录》）。 2、治血淋，配蒲黄、生地、赤茯苓、甘草，水煎服如《赤水玄珠》。 3、治便血，可配地榆、槐花等同用，如三灰散（《类证治裁》）。 4、治崩漏，可单用本品，与酒和服。 5、治小便不利，常与滑石、白鱼同用，如滑石白鱼散（《金匮要略》）。
藕节,光藕节、藕节巴、藕节炭,味甘、涩，性平；归肝、肺、胃经,化瘀止血，利尿。,藕节，中药名。为睡莲科莲属植物莲的根茎节部。具有收敛止血的功效。主治吐血、咯血、衄血等多种出血证。,藕节煎汁内服时，成人每天的常规用量为9～15克。 外用适量，可以研末后吹入鼻内，或用鲜藕节捣汁滴鼻。 无论饭前还是饭后服，服药与进食都应间隔0.5-1小时，以免影响药物吸收和药效的发挥。,,,,,,,,,,,忌铁器。,
艾叶,《名医别录》,艾草、艾蒿、家艾、野艾,辛、苦，温；有小毒。归肝、脾、肾经。,温经止血，散寒止痛，调经，安胎；外用祛湿止痒。,艾叶，中药名。为菊科蒿属植物艾的叶。具有温经止血，散寒止痛，祛湿止痒的功效。主治吐血，衄血，咯血，便血，崩漏，妊娠下血，月经不调，痛经，胎动不安，心腹冷痛，泄泻久痢，霍乱转筋，带下，湿疹，疥癣，痔疮，痈疡。地上部分生长最旺盛时或在花蕾将开放时，亦或在花盛开，果实尚未成熟时采收。 保存一年以上的艾叶，称为陈艾叶，简称“陈艾” ，而陈艾叶中以三年到五年为最好，俗称“三年陈艾”和“五年陈艾”。,艾叶配阿胶,艾叶配香附,艾叶配苍术,胶艾汤,艾附暖宫丸,固经丸,艾叶汤,保胎无忧片,,,艾叶煎汁内服时，成人每天的常规用量为3～9克。 或入丸、散；或捣汁。外用时适量，捣绒作柱或制成艾条熏灸；或捣敷；或煎水熏洗；或炒热温熨。 温经止血适宜炒炭用，其他用法多生用。 无论饭前还是饭后服，服药与进食都应间隔1小时左右，以免影响药物吸收和药效的发挥。,阴虚血热者慎服。
炮姜,黑姜,味苦、涩，性温；归脾、胃、肾、心、肺经,温经止血，温中止痛。,炮姜，中药名。为姜科姜属植物姜干燥根茎的炮制品。具有温经止血，温中止痛的功效。主治虚寒出血证、腹痛、腹泻等。,内服：煎汤，3-6g；或入丸、散。外用：研末调敷。,,,,,,,,,,,孕妇及阴虚有热者禁服。,
灶心土,《金匮要略》,伏龙肝、灶中黄土、釜下土、釜月下土、灶中土、灶内黄土,味辛，性温；归脾、胃经,温中止血，止呕，止泻。,灶心土，中药名。为久经柴草或木柴熏烧后灶内壁的土块。具有温中止血，止呕，止泻的功效。主治出血证、胃寒呕吐、脾虚久泻等。,,,,,,,,,,,内服：煎服，15-30g，布包，先煎；或60-120g，煎汤代水。亦可入丸、散，外用：适量。,阴虚失血及热证呕吐反胃者忌服。
川芎,《神农本草经》,山鞠穷、芎藭、香果、胡藭、芎藭、雀脑芎、京芎、贯芎、生川军,辛，温。归肝、胆、心包经。,活血行气，祛风止痛。,川芎，中药名，为伞形科藁本属植物川芎的干燥根茎。具有活血行气，祛风止痛的功效。主要用于心脉瘀阻之胸痹心痛、肝郁气滞之胁肋胀痛、肝血瘀阻之胸胁刺痛、瘀血阻滞之跌仆损伤、疮疡肿痛、月经不调、经闭痛经、产后瘀痛、恶露不行、多种头痛和风湿痹痛等。,川芎配白芍,川芎配柴胡,川芎配丹参,川芎配白芷,川芎配独活,柴胡疏肝散,通窍活血汤,川芎散,川芎茶调散,,川芎煎汁内服时，成人每天的常规用量为3~10克。或入丸、散剂。 外用时适量，研末撒于患处。 除消食药（应该在饭后及时服药）、镇静安神药（临睡前服用）等药物之外，一般药物无论饭前还是饭后服，服药与进食都应间隔1小时左右，以免影响药效的发挥与食物的消化。 用于治疗瘀血偏寒（可有怕冷、局部刺痛等表现）的病证时适宜酒炙用。,1.川芎辛温升散，肝阳上亢所引起的头痛慎用。 2.其温燥之性，有耗血伤阴之弊，阴虚火旺，舌红口干者不宜应用。 3.妇女月经过多及无瘀之出血疾病不宜应用。 4.孕妇忌用。
延胡索,《雷公炮炙论》,元胡、延胡、元胡索、玄胡、玄胡索,辛、苦，温。归肝、脾、心经。,活血，行气，止痛。,延胡索，中药名。为罂粟科紫堇属植物延胡索的干燥块茎。具有活血，行气，止痛的功效。主要用于气血瘀滞所致的各种痛证。如胸痹心痛、肝胃气痛、痛经、月经不调、产后瘀滞腹痛、寒疝腹痛、跌打损伤、瘀肿疼痛、风湿痹痛等。,,,,,,,,,,,煎服，3～10g；研末服，每次1.5～3g。醋制可加强止痛之功。,1.性温，凡外感风热或温热、火热内炽、阴虚火旺、血虚血热等证，不宜单味药大量服用。 2.辛散温通，善治气滞血瘀，有耗伤气血之弊。凡气虚、血虚及气血两虚者不宜单味药服用。老年人、婴幼儿不宜长期服用，月经过多及血虚无瘀者慎用。 3.可以抑制心脏活动，心功能不全等心脏病患者不宜大量长期服用。 4.有降低血压的作用，低血压患者不宜长期服用。 5.能减少胃酸分泌，萎缩性胃炎等病患者不宜长期服用。 6.对中枢神经系统有明显的抑制作用，婴幼儿、老年人不宜大量长期服用。 7.活血散瘀，容易损伤胎元，妊娠期妇女禁用。
姜黄,《新修本草》,黄姜、毛黄姜、黄丝郁金,辛、苦，温。归肝、脾经。,活血行气，通经止痛。,姜黄，中药名。为姜科姜黄属植物姜黄的干燥根茎。具有活血行气，通经止痛的功效。主治气滞血瘀痛证，风湿痹痛。,姜黄配桂枝,姜黄配羌活,姜黄配枳壳,五痹汤,姜桂散,姜黄散,利胆止痛片,,,,"姜黄煎汁内服时，成人每天的常规用量为3～10克。 入丸、散用；外用时适量,研末调敷。 多饭后服，无论饭前还是饭后服，服药与进食都应间隔0.5～1小时，以免影响药物的吸收和药效的发挥。",血虚无气滞血瘀慎服，孕妇忌用。
郁金,《药性论》,川郁金、广郁金、玉金,辛、苦，寒；归肝、胆、心、肺经。,活血止痛，行气解郁，清心凉血，利胆退黄。,郁金，中药名。为姜科姜黄属植物温郁金、姜黄、广西莪术或蓬莪术的干燥块根。具有活血止痛，行气解郁，清心凉血，利胆退黄的功效。主治气滞血瘀痛证，热病神昏，癫痫痰闭，吐血，衄血，倒经，尿血，血淋，肝胆湿热黄疸、胆石症。,郁金配柴胡,郁金配木香,郁金配茵陈,郁金配白矾,颠倒木金散,宣郁通经汤,白金丸,和胃片,,,郁金煎汁内服时，成人每天的常规用量为3～10克。研末服2～5克。 用于排石，剂量可稍大，临床生用居多，经过醋制后，疏肝止痛作用增强。 除消食药（应该在饭后及时服药）、镇静安神药（临睡前服用）等药物之外，一般药物无论饭前还是饭后服，服药与进食都应间隔1小时左右，以免影响药效的发挥与食物的消化。,阴虚失血及无气滞血瘀者忌服，孕妇慎服。
降香,《证类本草》,花梨母、降香黄檀,辛，温。归肝、脾经。,化瘀止血，理气止痛,降香，中药名。为豆科黄檀属植物降香檀树干和根的干燥心材。具有化瘀止血，理气止痛的功效。主治瘀血阻滞的出血，血瘀气滞的胸胁疼痛、跌损瘀痛，秽浊内阻脾胃的呕吐腹痛等。全年可采。,降香配五灵脂,降香配广藿香,立止吐血膏,七香散,跌打镇痛膏,正骨水,荣心丸,冠心安口服液,,,降香煎汁内服时，成人每天的常规用量为9~15克。 降香入煎剂宜后下。也可研末吞服，或入丸、散剂。 本品外用时适量，研细末敷患处。 除消食药（应该在饭后及时服药）、镇静安神药（临睡前服用）等药物之外，一般药物无论饭前还是饭后服，服药与进食都应间隔1小时左右，以免影响药效的发挥与食物的消化。,阴虚火旺，血热妄行者禁服。
没药,《开宝本草》,末药、明没药,辛、苦，平。归心、肝、脾经。,散瘀定痛，消肿生肌。,没药，中药名。为橄榄科没药属植物没药树或其他同属植物皮部渗出的油胶树脂。具有活血止痛，消肿生肌的功效。主治瘀血阻滞所致的跌打损伤，瘀滞肿痛、痈疽肿痛、疮疡溃后久不收口，胸痛、胁痛、心腹痛、痛经、产后腹痛、风湿痹痛，癥瘕积聚等。,没药配乳香,没药配延胡索,没药散,海浮散,手拈散,散结灵胶囊,风痛灵,,,,没药煎汁内服时，成人每天的常规用量为3～5克。多做成丸、散剂型使用。 外用适量，生用或炒用，研末外敷。 除消食药（应该在饭后及时服药）、镇静安神药（临睡前服用）等药物之外，一般药物无论饭前还是饭后服，服药与进食都应间隔1小时左右，以免影响药效的发挥与食物的消化。,1.没药活血散瘀，孕妇及无瘀滞者忌用。 2.味苦气浊，对胃有较强的刺激性，易引起恶心呕吐，有伤脾败胃之弊，脾胃虚弱者慎用，且不宜大剂量应用。
乳香,《名医别录》,天泽香、乳头香,辛、苦，温。归心、肝、脾经。,活血定痛，消肿生肌。,乳香，中药名。为橄榄科乳香属植物乳香树及同属植物树皮渗出的树脂。具有活血行气止痛，消肿生肌的功效。主治活血行气止痛，消肿生肌，气滞血瘀痛。,乳香配当归,乳香配儿茶,活络效灵丹,乳香饼子,乳香散,瘀血痹颗粒,活血解毒丸,飞龙夺命丸,,,乳香煎汁内服时，成人每天的常规用量为3～5克。或入丸、散。 外用适量，生用或炒用，研末调敷。 除消食药（应该在饭后及时服药）、镇静安神药（临睡前服用）等药物之外，一般药物无论饭前还是饭后服，服药与进食都应间隔1小时左右，以免影响药效的发挥与食物的消化。,胃弱者慎服，孕妇及无瘀滞者禁服。
五灵脂,《开宝本草》,寒雀粪、曷旦、灵脂米,苦、咸、甘，温。归肝经。,活血止痛，化瘀止血。,五灵脂，中药名。为鼯鼠科复齿鼯鼠动物复齿鼯鼠-之干燥粪便。具有活血止痛，化瘀止血的功效。主治瘀血阻滞诸痛证，如胸痹心痛、脘胁腹刺痛、痛经、经闭、产后瘀滞腹痛、骨折肿痛、出血证属瘀血内阻血不循经者。,五灵脂配高良姜,五灵脂配全蝎,五灵脂配川（草）乌,五灵脂配青（陈）皮,五灵脂配雄黄,失笑散,膈下逐瘀汤,小金丹,,,五灵脂煎汁内服时，成人每天的常规用量为3～10克，适宜包煎。 或入丸、散剂服用，外用时适量。 用于化瘀时，适合醋炙使用。用于活血止痛时，适合酒炙使用。 除消⻝药（应该在饭后及时服药）、镇静安神药（临睡前服⽤）等药物以外，⼀般药物无论饭前还是饭后服，服药与进⻝都应间隔1⼩时左右，以免影响药效的发挥与⻝物的消化。,1.传统认为人参畏五灵脂，属“十九畏”内容，故两药一般不宜配伍同用。 2.五灵脂善于活血化瘀，故血虚无瘀及孕妇慎用。
丹参,《神农本草经》,红根、大红袍、血参根,苦，微寒。归心、肝经。,活血祛瘀，通经止痛，清心除烦，凉血消痈。,丹参，中药名。为唇形科鼠尾草属植物丹参的干燥根和根茎。具有活血调经，祛瘀止痛，凉血消痈，除烦安神的功效。主治月经不调，闭经痛经，产后瘀滞腹痛，血瘀心痛，脘腹疼痛，癥瘕积聚，跌打损伤，风湿痹证，疮痈肿毒，热病烦躁神昏，心悸失眠。,丹参配赤芍,丹参配瓜蒌,丹参配砂仁,丹参配乳香,丹参配人参,丹参散,丹参饮,消乳汤,,,丹参煎汁内服时，成人每天的常规用量为10～15克。 除消食药（应该在饭后及时服药）、镇静安神药（临睡前服用）等药物以外，一般药物无论饭前还是饭后服，服药与进食都应间隔1小时左右，以免影响药效的发挥与食物的消化。 用于清心除烦时，适合生用。用于活血化瘀调经时，适合酒炙使用。,妇女月经过多及无瘀血者禁服；孕妇慎服；反藜芦。
牛膝,《神农本草经》,怀牛膝、牛髁膝、山苋菜、牛七,苦、甘、酸，平。归肝、肾经。,逐瘀通经，补肝肾，强筋骨，利尿通淋，引血下行。,牛膝，中药名。为苋科牛膝属植物牛膝怀牛膝和川牛膝属杯苋属植物川牛膝甜牛膝的根。具有活血通经，补肝肾，强筋骨，利水通淋，引火血下行的功效。主治瘀血阻滞经闭、痛经、经行腹痛、胞衣不下，跌打伤痛，腰膝酸痛，下肢痿软，淋证，水肿，小便不利，头痛，眩晕，齿痛，口舌生疮，吐血，衄血。,牛膝配丹参,牛膝配威灵仙,牛膝配山茱萸,牛膝配生地黄,牛膝配车前子,镇肝息风汤,牛膝汤,牛膝散,,,牛膝煎汁内服时，成人每天的常规用量为5～15克。 用于逐瘀通经、利尿通淋、引火（血）下行时，适合生用。用于补肝肾、强筋骨时，适合酒炙用。 除消食药（应该在饭后及时服药）、镇静安神药（临睡前服用）等药物以外，一般药物无论饭前还是饭后服，服药与进食都应间隔1小时左右，以免影响药效的发挥与食物的消化。,凡中气下陷，脾虚泄泻，下元不固，梦遗滑精，月经过多及孕妇均禁服。
鸡血藤,《本草纲目拾遗》,血风、血藤、血风藤,苦、甘，温。归肝、肾经。,活血补血，调经止痛，舒筋活络。,,鸡血藤配当归,新血宝胶嚢,骨增消片,脑心安胶囊,乳癖消颗粒,复方紫参冲剂,闭经，经前腹痛，产后腹痛,月经不调，痛经，病理性闭经,,,鸡血藤多入煎剂服用，成人每天的常规用量为9～15克。 鸡血藤也可以泡酒服用，或熬膏剂服用。 除消食药（应该在饭后及时服药）、镇静安神药（临睡前服用）等药物以外，一般药物无论饭前还是饭后服，服药与进食都应间隔1小时左右，以免影响药效的发挥与食物的消化。,阴虚火亢人群谨慎服用鸡血藤。
月季花,《本草纲目》,四季花、月月红、月季红,甘，温。归肝经。,活血调经，疏肝解郁。,月季花，中药名。为蔷薇科蔷薇属植物月季的干燥花。具有活血调经，疏肝解郁，消肿解毒的功效。主治肝郁血滞，月经不调、痛经、闭经及胸胁胀痛，跌打损伤，瘀肿疼痛，痈疽肿毒，瘰疬。,月季花配益母草,月季花配柴胡,月季花汤,玉液金丸,月经延后,月经不调、痛经等,,,,,月季花水煎服，成人每天的常规用量为3~6克，也可以入丸、散剂，或者泡茶饮用。 外用适量，可以鲜品捣敷患处，或者干品研末调搽患处。 除消食药（应该在饭后及时服药）、镇静安神药（临睡前服用）等药物之外，一般药物无论饭前还是饭后服，服药与进食都应间隔1小时左右，以免影响药效的发挥与食物的消化。,用量不宜过大，多服久服可引起腹痛及便溏腹泻。孕妇慎用。
红花,《新修本草》,红蓝花、刺红花、草红花,辛，温。归心、肝经。,活血通经，散瘀止痛。,红花，中药名。为菊科红花属植物红花的干燥花。具有活血通经，祛瘀止痛的功效。主治血滞经闭、痛经，产后瘀滞腹痛，癥瘕积聚，胸痹心痛，血瘀腹痛，胁痛，跌打损伤，瘀滞肿痛，瘀滞斑疹色暗。在花刚开放时采收。,,,,,,,,,,,煎服，3～10g。,孕妇忌用。月经过多者慎服。
凌霄花,《神农本草经》,紫葳、五爪龙、红花倒水莲、倒挂金钟、上树龙、堕胎花、藤萝花,甘、酸，寒。归肝、心包经。,活血通经，凉血祛风。,凌霄花，中药名。为紫葳科凌霄花属植物凌霄或美洲凌霄的花。具有破瘀通经，凉血祛风的功效。主要用于瘀血阻滞的经闭、癥瘕积聚、跌打损伤、风疹、皮癣、皮肤瘙痒、痤疮等。,,,,,,,,,,,凌霄花破血力胜，故孕妇及气血虚弱者忌用。,
王不留行,《神农本草经》,奶米、王不留、老头蓝子,苦、平。归肝、胃经。,活血通经，下乳消肿，利尿通淋。,王不留行，中药名。为石竹科王不留行属植物麦蓝菜的干燥成熟种子。具有活血通经，下乳消痈，利尿通淋的功效。主治血瘀经闭、痛经、难产，产后乳汁不下，乳痈肿痛，热淋，血淋，石淋。,,,,,,,,,,,煎服，可包煎也可以直接煎，5～10g。,孕妇、血虚无瘀滞者均禁服。
益母草,《神农本草经》,益母蒿、坤草、茺蔚,苦、辛，微寒。归肝、心包、膀胱经。,活血调经，利尿消肿，清热解毒。,益母草，中药名。为唇形科益母草属植物益母草的新鲜或干燥地上部分。具有活血调经，利尿消肿，清热解毒的功效。症状月经不调，痛经经闭，恶露不尽，水肿尿少，疮疡肿毒。在开花时采收。,益母草配香附,益母草配当归,益母草配红花,益母胜金丹,益母地黄汤,益母种子丸,益母丸,益母草颗粒（膏、胶囊、口服液）,,,益母草煎汁内服时，成人每天的常规用量为9～30克，鲜品12～40克。 熬膏，或入丸、散。外用适量，煎汤外洗或鲜草捣敷。 除消食药（应该在饭后及时服药）、镇静安神药（临睡前服用）等药物之外，一般药物无论饭前还是饭后服，服药与进食都应间隔1小时左右，以免影响药效的发挥与食物的消化。,孕妇慎用。
泽兰,《神农本草经》,地瓜苗、地笋、甘露子、方梗泽兰,苦、辛，微温。归肝、脾经。,活血调经，祛瘀消痈，利水消肿。,泽兰，中药名。为唇形科地笋属植物地笋及毛叶地笋的地上部分。具有活血调经，祛瘀消痈，利水消肿的功效。主治月经不调，经闭，痛经，产后瘀血腹痛，疮痈肿毒，水肿腹水。,泽兰配当归,泽兰配红花,泽兰配丹参,泽兰配防己,泽兰汤（《鸡峰普济方》）,泽兰汤（《外科十法》）,泽兰酒,调经活血片,,,泽兰煎汁内服时，成人每天的常规用量为6～12克，或入丸、散。 泽兰外用适量，鲜品捣敷，或煎水熏洗。 除消食药（应该在饭后及时服药）、镇静安神药（临睡前服用）等药物之外，一般药物无论饭前还是饭后服，服药与进食都应间隔1小时左右，以免影响药效的发挥与食物的消化。,无瘀滞者慎用。
桃仁,味苦、甘，性平；归心、肝、大肠经,活血祛瘀，润肠通便，止咳平喘。,桃仁，中药名。为蔷薇科桃属植物桃或山桃的干燥成熟种子。果实成熟后采收，除去果肉和核壳，取出种子，晒干。全国各地普遍栽培。具有活血祛瘀，润肠通便，止咳平喘的功效。主治经闭痛经，瘕瘕痞块，肺痈肠痈，跌扑损伤，肠燥便秘，咳嗽气喘。,桃仁煎汁内服时，成人每天的常规用量为5～10克。 桃仁霜入汤剂宜包煎。 除消食药（应该在饭后及时服药）、镇静安神药（临睡前服用）等药物之外，一般药物无论饭前还是饭后服，服药与进食都应间隔1小时左右，以免影响药效的发挥与食物的消化。,1、桃仁功善活血，有堕胎之弊，孕妇忌用。 2、富含油脂，具有润肠通便之功，脾虚便溏者慎用。 3、含苦杏仁苷，在体内可分解成氢氰酸，大量服用易引起中毒，故临床用量不宜过大。,,,,,,,,,,,,1、小儿疟疾：乌猫屎一钱，桃仁七枚，同煎，服一盏立瘥（《温居士方》） 2、反胃吐食：以乌骨鸡一只，与水饮四五日，勿与食。将五蒲蛇二条，竹刀切与食。待鸡下粪，取阴干为末，水丸粟米大。每服一分，桃仁汤下。五七服即愈。（《证治发明》） 3、盘肠钓气：越桃仁半两，草乌头少许，同炒过，去草乌，入白芷一钱，为末。每服半钱，茴香葱白酒下。（《普济方》）
骨碎补,《药性论》,槲蕨、崖姜、岩连姜、爬岩姜、肉碎补、石碎补、飞天鼠、牛飞龙、飞来风,苦，温。归肝、肾经。,活血疗伤止痛，补肾强骨；外用消风祛斑。,骨碎补，中药名。为水龙骨科植物槲蕨、中华槲蕨、石莲姜槲蕨、崖姜、光亮密网蕨以及骨碎补科植物大叶骨碎补、海州骨碎补等的根茎的根茎。具有活血续伤，补肾强骨的功效。主治跌打损伤或创伤，筋骨损伤，瘀滞肿痛，肾虚腰痛脚弱，耳鸣耳聋，牙痛，久泄。,骨碎补配没药,骨碎补配补骨脂,骨碎补散,接骨七厘片,遗尿,,,,,,骨碎补煎汁内服时，成人每天的常规用量为3～9克。 或入丸、散。外用时适量，捣敷或研末调敷、或者泡酒涂擦。 除消食药（应该在饭后及时服药）、镇静安神药（临睡前服用）等药物之外，一般药物无论饭前还是饭后服，服药与进食都应间隔1小时左右，以免影响药效的发挥与食物的消化。,1.阴虚火旺及无瘀血或血虚有火者不宜使用。若症见潮热盗汗，五心烦热，舌红少苔，或面白无华，乏力头晕，口舌生疮者当忌用。 2.骨碎补味苦能坚肾，温燥又可活血破血，如再加风药之温燥，常可伤及血液，故主张血虚诸证忌用，尤其不宜与风药配伍同用。血虚风燥，皮肤干痒，大便干结者，血虚不能养筋，拘急挛痛者，皆应忌用。 3.阳热炽盛者不宜使用，如外感风热，发热微恶风寒，咽痛，口渴者，或热入气分，壮热口渴脉洪大者，以及胃肠积热，大便干结不解者，皆应忌用，以免助热生变。 4.骨碎补温燥伤阴，故血虚风燥者忌用。 5.骨碎补有活血散瘀的作用，故血虚无瘀者慎用。 6.本品的严重不良反应为变态反应，可表现为全身皮疹、瘙痒，喉头水肿、呼吸困难，甚至过敏性休克，故过敏体质者忌用。 7.《本草经疏》云：“不宜与风燥药同用。”《得配本草》谓：“忌羊肉、羊血、芸薹菜。 8.有服用大剂量本品造成急性中毒的报道，表现为口干、多语、心慌胸闷、恐惧感等，继而出现神志恍惚、胡言乱语等中毒症状。据此认为，本品临床不可大剂量使用。
