药材,别名,性味归经,功用,症状,药材分类,用法用量,注意事项
罗布麻,吉吉麻、羊肚拉角、红花草、野茶、泽漆麻、茶叶花、红麻、披针叶茶叶花、小花野麻、野茶叶、草本夹竹桃、小花罗布麻、红柳子、泽漆棵、盐柳、野柳树。,味甘、微苦，性凉,平抑肝阳，清热利尿，安神。,1、主治肝阳上亢及肝火上炎之头晕目眩，烦躁失眠，惊痫抽搐，水肿、小便不利而有热者，血热吐血、衄血，外伤出血，风热外感。 2、西医诊为高血压病、心脑血管疾病、脑恶性肿瘤等属于肝阳上亢，神经衰弱、慢性心功能不全属肝郁化热扰动心神，心源性水肿、肾源性水肿、膀胱炎等属水气内停，内有郁热者，以及上呼吸道感染、流行性感冒等。,有小毒,内服：煎汤，5-10g；或泡茶。,
紫河车,胞衣、人胞、混沌皮、仙人衣、混沌衣、混元丹、佛袈裟、胎衣,味甘、咸，性温；归肺、肝、肾经,补精助阳，养血益气。,主要用于不孕少乳，阳痿遗精，腰酸耳鸣，消瘦乏力，面色萎黄，骨蒸劳热，肺肾虚喘等。,动物,内服：研末，每次1.5-3g，重症加倍；或入丸剂；新鲜胎盘，半个或1个，水煎服食，每星期2-3次。,1、本品性温，凡外感风热或温热、实热内炽，阴虚火旺、血虚血热等证不宜单味药大量服用。
赤芍,木芍药、草芍药、红芍药、毛果赤芍,味苦，性微寒；归肝经,清热凉血，活血祛瘀。,1、温毒发斑，血热吐衄：本品苦寒入肝经血分，善清泻肝火，泄血分郁热而奏凉血，止血之功。  2、目赤肿痛，痈肿疮疡：本品苦寒入肝经而清肝火。  3、肝郁胁痛，经闭痛经，癥瘕腹痛，跌打损伤：本品苦寒入肝经血分，有活血散瘀止痛之功。,植物,内服：煎服，6-12g。,不与藜芦同用。血虚者慎服。
金钱草,神仙对坐草、地蜈蚣、蜈蚣草、铜钱草、仙人对坐草、大金钱草、对坐草、一串钱、黄疸草、一面锣、金钱肺筋草、藤藤侧耳根、大连钱草、遍地黄、黄花过路草、龙鳞片,味甘、咸，性微寒；归肝、胆、肾、膀胱经,利湿退黄，利尿通淋，解毒消肿。,主要用于黄疸、水肿、风湿痹痛、疟疾、带下、淋浊、痈肿、疮癣等。 ,植物,内服：煎汤，15-60g，鲜品加倍；或捣汁饮。外用：鲜品捣敷。,1、性寒，凡外感风寒、内伤生冷、脾胃虚寒、肾阳虚衰等证不宜单味药大量长期服用。
莱菔子,萝卜子、芦菔子,味辛、甘，性平；归肺、脾、胃经,消食除胀，降气化痰。,1、食积气滞：本品味辛行散，消食化积之中，尤善行气消胀。  2、咳喘痰多、胸闷食少：本品既能消食化积，又能降气化痰，止咳平喘。,植物,内服：煎服，6-10g。,本品辛散耗气，故气虚及无食积、痰滞者慎用。不宜与人参同用。
白芷,芷、芳香、苻蓠、泽芬、白茝、香白芷,味辛，性温；归肺、胃、大肠经,解表散寒，祛风止痛，通鼻窍，燥湿止带，消肿排脓，祛风止痒。,1、主要用于风寒感冒，头痛、牙痛、痹痛等多种疼痛，鼻渊，带下证，疮痈肿毒，皮肤风湿瘙痒等。  2、西医诊为感冒、流行性感冒属于风寒表证者，头痛、偏头痛、牙周病等见有表证者，风湿性关节炎、类风湿性关节炎、神经痛性肌萎缩症、肩部粘连囊炎、滑膜炎及肌腱滑膜炎、其他无菌性骨坏死、痛风性关节炎等属于风湿之邪阻滞经络者，急性鼻窦炎、慢性鼻窦炎见有风寒表证者，急性输卵管炎及卵巢炎、子宫炎症等属于阳明经湿邪下注者，接触性皮肤炎及其他湿疹、痈及疖等见有表证者。,植物,内服：煎服，3-10g。或入丸、散。外用：研末撒或调敷。,本品辛香温燥，阴虚血热者忌服。
牛黄,犀黄、丑宝,味甘，性凉；归心、肝经,化痰开窍，凉肝息风，清热解毒。,1、热病神昏：本品性凉，其气芳香，入心经，能清心，祛痰，开窍醒神。故用治温热病热入心包及中风，惊风，癫痫等痰热阻闭心窍所致神昏谵语，高热烦躁，口噤，舌蹇，痰涎壅塞等症。  2、小儿惊风，癫痫：本品入心、肝二经，有清心，凉肝，息风止痉之功。常用治小儿急惊风之壮热，神昏，惊厥抽搐等症，治痰蒙清窍之癫痫发作，症见突然仆倒，昏不知人，口吐涎沫，四肢抽搐。  3、口舌生疮，咽喉肿痛，牙痛，痈疽疔毒：本品性凉，为清热解毒之良药，用治火毒郁结之口舌生疮，咽喉肿痛，牙痛；咽喉肿痛，溃烂；痈疽，疔毒，疖肿等；亦可用治乳岩、横痃、痰核、流注、瘰疬、恶疮等证。,动物,内服：入丸，散剂，每次0.1-0.35g。外用：适量，研末敷患处。,1、《本草经集注》：“人参为之使。恶龙骨、地黄、龙胆、蜚蠊。畏牛膝。”
穿破石,柘根、川破石、地棉根、拉牛入石、黄蛇,味淡，微苦，性凉,祛风通络，清热除湿，解毒消肿。,主要用于风湿痹痛，跌打损伤，黄疽，腮腺炎，肺结核，胃和十二指肠溃疡，淋浊，蛊胀，闭经，劳伤咳血，疗疮痈肿。,植物,内服：煎汤，9-30g，鲜者可用至120g；或浸酒。外用：捣敷。,
山芝麻,岗油麻、岗脂麻、田油麻、仙桃草、野芝麻、狗屎树、假芝麻、山麻、假油麻、芝麻头、牛釜尾、山野麻、白头公、油麻甲、野麻甲、假麻甲、苦麻、由脂麻、坡油麻、坡片公,江西、福建、台湾、湖南、广东、海南、广西、云南等地,清热解毒。,感冒发热，肺热咳嗽，咽喉肿痛，麻疹，痄腮，肠炎，痢疾，痈肿，瘰疬，痔疮，毒蛇咬伤。,味辛、微苦，性凉；归心、肺、大肠经,内服：煎汤，9-15g，鲜品30-60g。外用：适量，鲜品捣敷。,孕妇及虚寒证慎服，内服过量有泻下、恶心等副反应。
牛蒡子,恶实、鼠粘子、黍粘子、大力子、毛燃燃子、黑风子、毛锥子、粘苍子、大牛子、牛子、土大桐子、万把钩、鼠尖子,味辛、苦，性寒；归肺、胃经,疏散风热，宣肺祛痰，利咽透疹，解毒消肿。,主要用于风热感冒，温病初起，麻疹不透，风疹瘙痒，痈肿疮毒，丹毒，痄腮喉痹。 ,植物,内服：煎服，5-10g。或入散剂。外用：煎汤含漱。,本品性寒，滑肠通便，气虚便溏者慎用。
岩黄连,味苦，性凉。归胃、大肠经,无毒,清热解毒，利湿，止痛止血。,肝炎，口舌糜烂，火眼，目翳，痢疾，腹泻，腹痛，痔疮出血。,植物,内服：煎汤，3-15g。外用：适量，研末点患处。,忌燥、辣食物。
水蜈蚣,球子草、疟疾草、三荚草、金牛草、寒气草、金钮草、夜摩草、十字草、姜虫草、露水草、水牛草、三步跳、散寒草、姜芽草、寒筋草、水香附、燕含珠、发汗草、山蜈蚣、无头香附、龙吐珠、三夹草、水香草、一粒雪、三,味辛、微苦、甘，性平。归肺、肝经,疏风解表，清热利湿，活血解毒。,用于感冒发热头痛，急性支气管炎，百日咳，疟疾，黄疸，痢疾，乳糜烂，疮疡肿毒，皮肤瘙痒，毒蛇咬伤，风湿性关节炎，跌打损伤。,植物,内服：煎汤，15-30g，鲜品30-60g；或捣汁；或浸酒。外用：适量，捣敷。,阴虚者不宜用。
灯盏花,灯盏细辛、灯盏菊、细辛草、地顶草、地朝阳、双葵花、东菊、灯盏草、牙陷药（贵州）、罐儿草（四川）,味辛、微苦，温；归肺、胃、肝经,散寒解表，祛风除湿，活络止痛，消积。,感冒，风湿痹痛，瘫痪，胃痛，牙痛，小儿疳积，骨髓炎，跌打损伤。,植物,内服：煎汤，9-15g；或蒸蛋。外用：适量，捣敷。,尚不明确。
狗脊,百枝、狗青、强膂、扶盖、扶筋、苟脊、金毛狗脊、金狗脊、黄狗头、金毛狮子、毛狗儿、金丝毛、金扶筋、金猫咪、老猴毛,味苦、甘，性温；归肝、肾经,祛风湿，补肝肾，强腰膝。,1、风湿痹证：本品苦温能温散风寒湿邪，甘温以补肝肾、强腰膝、坚筋骨，能行能补，对肝肾不足，兼有风寒湿邪之腰痛脊强，不能俯仰者最为适宜。  2、腰膝酸软，下肢无力：本品补肝肾，强腰膝之功，又能治肝肾虚损，腰膝酸软，下肢无力者。  3、遗尿，白带过多：本品又有温补固摄作用,植物,内服：煎服，6-12g。,肾虚有热，小便不利，或短涩黄赤，口苦舌干者，均禁服。
炒白术,山蓟、杨枹蓟、术、山芥、天蓟、山姜、山连、山精、乞力伽、冬白术,味苦、甘，性温。归脾、胃经。,补气健脾，燥湿利水，止汗，安胎。,用于脾气虚弱，脾虚积滞，脾虚饮停，痰饮，肌表不固而汗多以及胎动不安。,植物,内服：煎汤，6-12g；熬膏或入丸、散。,1、性温，凡外感风热或温热、实热内炽，阴虚火旺、血虚血热等证不宜单味药大量服用。
百药煎,味酸，性平；归肺、胃经,植物,润肺化痰，止血止泻，解热生津。,久咳劳嗽，咽痛，口疮，牙疳，便血，血痢，泄泻，脱肛，暑热口渴。,,内服：煎汤，1～3钱；或入丸、散。外用：研末撒、调敷或泡汤含漱。,外感咳嗽，湿热泻痢及积滞未清者均慎服。
火棘,火把果、救军粮、救兵粮、救命粮、赤阳子、红子、豆金娘、水搓子,味甘、酸，性平,果：消积止痢，活血止血。,果：消化不良，肠炎，痢疾，小儿疳积，崩漏，白带，产后腹痛。 根：虚痨骨蒸潮热，肝炎，跌打损伤，筋骨疼痛，腰痛，崩漏，白带，月经不调，吐血，便血。 叶：外敷治疮疡肿毒。,植物,内服：果30g，根15-30g。外用：叶适量。,
紫花地丁,野堇菜、光瓣堇菜,味苦、辛，性寒；归心、肝经,清热解毒，凉血消肿。,主要用于疔疮痈疽，丹毒，痄腮，乳痈，肠痈，瘰疬，湿热泻痢，黄疸，目赤肿痛，毒蛇咬伤。 ,植物,内服：煎汤，10-30g，鲜品30-60g。外用：捣敷。,阴疽漫肿无头及脾胃虚寒者慎服。
鸡枞,鸡枞蕈、鸡菌、蚁夺、鸡枞菜、鸡脚蘑菇、三坛蘑、鸡肉丝菇、斗鸡菇,味甘，性平,健脾和胃，疗痔。,脘腹胀满，消化不良，精神疲乏，痔疮。,无毒,内服：煎汤，6-9g。,
桑寄生,茑、寓木、宛童、桑上寄生、寄屑、寄生树、茑木,味苦、甘，性平；归肝、肾经,祛风湿，补肝肾，强筋骨，安胎。,1、风湿痹证：本品苦能燥，甘能补，祛风湿又长于补肝肾、强筋骨，对痹证日久，伤及肝肾，腰膝酸软，筋骨无力者尤宜。  2、崩漏经多，妊娠漏血，胎动不安：本品能补肝肾，养血而固冲任，安胎。治肝肾亏虚，月经过多，崩漏，妊娠下血，胎动不安者。  3、本品尚能降血压，可用于高血压病。,植物,内服：煎服，9-15g。,尚不明确。
金铃子,川楝子、川楝实,味苦，性寒；归肝、胃、小肠经,疏肝泄热，行气止痛，杀虫。,1、脘腹胁肋疼痛：川楝子有止痛之功，尤适用于热厥心痛和肝胃气滞，郁而化热之脘胁疼痛。  2、疝气疼痛：川楝子疏肝行气止痛，有“治疝专药”之誉。  3、虫积腹痛：川楝子有驱虫、止痛之功，尤适用于蛔虫引起的腹痛。  4、头癣：川楝子苦寒清热，杀虫治癣。,有小毒,内服：煎汤，3-10g；或入丸、散。外用：适量，研末调涂。行气止痛炒用，杀虫生用。,1、脾胃虚寒者禁服。
五灵脂,药本、寒号虫粪、寒雀粪,味苦、咸、甘，性温；归肝经,活血止痛，化瘀止血。,1、主要用于瘀血阻滞诸痛证，如胸痹心痛、脘胁腹刺痛、痛经、经闭、产后瘀滞腹痛、骨折肿痛、出血证属瘀血内阻血不循经者。  2、西医诊为冠心病心绞痛、慢性胃炎、胃溃疡及十二指肠溃疡、慢性结肠炎、痛经、功能性子宫出血、跌损骨折等属瘀血阻滞证者。,动物,内服：煎汤，5-10g；或入丸、散。外用：适量，研末撒或调敷。,1、传统认为人参畏五灵脂，属“十九畏”内容，故两药一般不宜配伍同用。
玉米须,玉麦须、玉蜀黍蕊、棒子毛,味甘，性平；归膀胱、肝、胆经,利水消肿，利湿退黄。,1、水肿：本品甘淡渗泄，功专利水渗湿消肿。  2、黄疸：本品能利湿而退黄，药性平和，故阳黄或阴黄均可用。,植物,内服：煎服，30-60g。鲜者加倍。,尚不明确。
何首乌,首乌、地精、赤敛、陈知白、红内消、马肝石、疮帚、山奴、山哥、山伯、山翁、山精、夜交藤根、黄花污根、血娃娃、小独根、田猪头、铁称陀、赤首乌、山首乌、药首乌、何相公,味苦、甘、涩，性微温；归肝、肾经,1、何首乌：解毒，消痈，截疟，润肠通便。,生何首乌用于疮痈，瘰疬，风疹瘙痒，久疟体虚，肠燥便秘。制何首乌用于血虚萎黄，眩晕耳鸣，须发早白，腰膝酸软，肢体麻木，崩漏带下，高脂血症。,植物,1、内服：煎汤，10-20g；熬膏、浸酒或入丸、散。外用：适量，煎水洗、研末撒或调涂。 2、养血滋阴，宜用制何首乌；润肠通便，祛风，截疟，解毒，宜用生何首乌。,大便溏泄及有湿痰者慎服。忌铁器。
桑叶,铁扇子、蚕叶,味甘、苦，性寒；归肺、肝经,疏散风热，清肺润燥，平抑肝阳，清肝明目。,1、风热感冒，温病初起：本品甘寒质轻，轻清疏散，虽疏散风热作用较为缓和，但又能清肺热、润肺燥，故常用于风热感冒，或温病初起，温热犯肺，发热、咽痒、咳嗽等症。  2、肺热咳嗽，燥热咳嗽：本品苦寒清泄肺热，甘寒凉润肺燥，故可用于肺热或燥热伤肺，咳嗽痰少，色黄而黏稠，或干咳少痰、咽痒等症。  3、肝阳眩晕：本品苦寒，兼入肝经，有平降肝阳之效，故可用治肝阳上亢，头痛眩晕，头重脚轻，烦躁易怒者。  4、目赤昏花：本品既能疏散风热，又苦寒入肝能清泄肝热，且甘润益阴以明目，故常用治风热上攻、肝火上炎所致的目赤、涩痛、多泪。  5、本品尚能凉血止血，还可用治血热妄行之咳血、吐血、衄血，宜与其他凉血止血药同用。 ,植物,内服：煎服，5-9g；或入丸散。外用：煎水洗眼。,尚不明确。
鸭脚木,味辛、苦，性凉。归肺、肝经,无毒,根皮、茎皮：清热解表，祛风除湿，舒筋活络。根：疏风清热，除湿通络。叶：祛风化湿，解毒，活血。,根皮、茎皮：感冒发热，咽喉肿痛，烫伤，无名肿毒，风湿痹痛，跌打损伤，骨折。根：感冒，发热，妇女热病夹经，风湿痹痛，跌打损伤。叶：风热感冒，咽喉肿痛，斑疹发热，风疹瘙痒，风湿疼痛，湿疹，下肢溃疡，疮疡肿毒，烧伤，跌打肿痛，骨折，刀伤出血。,植物,根皮、茎皮：内服时，煎汤，9-15g；或浸酒。外用时，适量，煎水洗；或捣敷。 根：内服时，煎汤，3-9g，鲜品加倍；或浸酒。外用时，适量，煎汤洗；或研末调敷；或捣敷。 叶：内服时，煎汤，6-15g；或研末为丸。外用时，适量，捣汁涂；或酒炒敷。,孕妇忌服。高血压、心脏病患者慎用。
水飞蓟,水飞雉、奶蓟,苦，凉。归肝、胆经,清热解毒，疏肝利胆。,肝胆湿热，胁痛，黄疸。,无毒,1供配制成药用。（《中华人民共和国药典》）2用水飞蓟宾（水飞蓟素、奶蓟素、西利马灵）治疗肝炎，口服每次70～140毫克，每日3次，至少服5～6周，症状改善后，给予维持量，每次35～70毫克，每日3次。用糖衣丸（每粒35毫克）亦可。（《全国中草药汇编》）,尚不明确。
艾叶,医草、炙草,味辛、苦，性温；归肝、脾、肾经,温经止血，散寒止痛，祛湿止痒。,1、各种出血证：艾叶性温，能温经止血，尤宜用于虚寒性出血。  2、虚寒性腹痛：艾叶能散寒止痛，暖宫助孕。  3、泻痢霍乱，妇女带下：艾叶辛温散寒，苦温燥湿，故适用于泻、带下属寒湿下注者。  4、泻、带下属寒湿下注。,植物,内服：煎汤，3-10g；或入丸、散；或捣汁。外用：适量，捣绒作炷或制成艾条熏灸；或捣敷；或煎水熏洗；或炒热温熨。,阴虚血热者慎服。
玉竹,玉术、山玉竹、笔管子、十样错、竹七根、竹节黄、黄脚鸡、百解药、山姜、黄蔓菁、尾参、,湖南邵东、祁阳；河南嵩县、伊川；江苏海门、南通；浙江新昌、孝丰；河北、安徽、江西、东北等地,养阴润燥，生津止渴。,主要用于燥热咳嗽，津伤口渴，阴虚外感，头痛身热等。 ,味甘，性平；归肺、胃经,内服：煎汤，6-12g；熬膏、浸酒或入丸、散。外用：适量，鲜品捣敷；或熟膏涂。阴虚有热宜生用，热不甚者宜制用。,痰湿气滞者禁服，脾虚便溏者慎服。
穿心草,穿钱草、顶心风、穿心莲、狮子草,广西、贵州,清热解毒，理气活血。,主要用于肺热咳嗽，肝炎，钩端螺旋体病，黄疸，胸痛，胃痛，跌打内瘀，毒蛇咬伤。,味微甘，微苦，性凉,内服：煎汤，9-15g；鲜品及治毒蛇咬伤用量加倍。外用：煎水洗。,孕妇慎用。
石脑油,石漆、石脂水、猛火油、石油、鄜延脂、雄黄酒、硫黄油、地脂、泥油、石烛、火井油、火油。,味辛、苦，性寒,解毒杀虫。,用于疮疖，顽癣恶疥，蛲虫。,有毒,外用：适量，涂敷患处。一般不作内服。,本品有毒，故一般不内服。
醍醐,味甘、性凉。归肺经,植物,滋阴清热，益肺止血，止渴润燥。,用于虚劳烦热惊悸，肺痿咳唾脓血，消渴，便秘，风痹，皮肤瘙痒。,,内服：烊冲，适量。外用：适量，涂摩。,脾虚湿盛者禁服。
淮山,山药、薯蓣、山薯蓣、怀山药、白山药,味甘，性平；归脾、肺、肾经,益气养阴，补脾肺肾，固精止带。,1、脾虚证：本品性味甘平，能补脾益气，滋养脾阴。多用于脾气虚弱或气阴两虚，消瘦乏力，食少，便溏；或脾虚不运，湿浊下注之妇女带下。唯其亦食亦药，“气轻性缓，非堪专任”，对气虚重证，常嫌力量不足。 2、肺虚证：本品又能补肺气，兼能滋肺阴。其补肺之力虽较和缓，但对肺脾气阴俱虚者，补土亦有助于生金。 3、肾虚证：本品还能补肾气，兼能滋养肾阴，对肾脾俱虚者，其补后天亦有助于充养先天。适用于肾气虚之腰膝酸软，夜尿频多或遗尿，滑精早泄，女子带下清稀及肾阴虚之形体消瘦，腰膝酸软，遗精等症。 4、消渴气阴两虚证：消渴一病，与脾肺肾有关，气阴两虚为其主要病机。本品既补脾肺肾之气，又补脾肺肾之阴。,植物,内服：煎汤，15-30g，大剂量60-250g；或入丸、散。外用：适量，捣敷。补阴，宜生用；健脾止泻，宜炒黄用。,湿盛中满或有实邪、积滞者禁服。
八哥,寒皋、鸲鹆、花鹆、哵哵鸟,甘，平,下气，止血。,久嗽，呃逆，痔疮出血。,动物,内服：炙干研末作丸、散，或煮羹。,孕妇不宜用。
鸡血藤,血风藤、马鹿藤、紫梗藤、猪血藤、九层风、红藤、活血藤、大血藤、血龙藤、过岗龙、五层血,广西、云南,行血补血，调经，舒筋活络。,1、月经不调，痛经，闭经：本品苦而不燥，温而不烈，行血散瘀，调经止痛，性质和缓，又兼补血作用，凡妇人血瘀，血虚之月经病证均可应用。  2、风湿痹痛，手足麻木，肢体瘫痪，血虚萎黄：本品行血养血，舒筋活络，为治疗经脉不畅，络脉不和病证的常用药。,味苦、微甘，性温；归肝、肾经,内服：煎服，10-30g。或浸酒服，或熬膏服。,尚不明确。
石韦,小石韦、飞刀剑、石皮,味甘、苦，性微寒；归肺、膀胱经,利尿通淋，清肺止咳，凉血止血。,主要用于淋证、肺热咳喘、血热出血、崩漏、痢疾、金创、痈疽等。,植物,内服：煎汤，9-15g；或研末。外用：研末涂敷。,阴虚及无湿热者忌服。
南瓜蒂,味苦，微甘，性平,植物,解毒，利水，安胎。,主要用于痈疽肿毒，疔疮，烫伤，疮溃不敛，水肿腹水，胎动不安。,,内服：煎汤，15-30g；或研末。外用：研末调敷。,
刺五加,刺拐棒、老虎镣子,味甘，性微苦；归脾、肺、心、肾经,益气健脾，补肾安神。,主要用于脾肺气虚，肾虚腰膝酸痛，心脾不足失眠，健忘等。,植物,内服：煎汤，6-15g；或入丸、散；泡酒。外用：适量，研末调敷；或鲜品捣敷。,阴虚内热之证慎用。
全蝎,虿、奎、杜伯、主簿虫、虿尾虫、全虫、茯背虫、蝎子,河南、山东、湖北、安徽,息风镇痉，攻毒散结，通络止痛。,主要治疗各种原因引起的惊风，痉挛抽搐；疮疡肿毒，瘰疬结核，脱疽，乳房痈肿；风湿顽痹，筋脉拘挛；顽固性偏正头痛；并能够治疗多种肿瘤。 ,味辛，性平，归肝经,内服：煎汤，2-5g；研末入丸、散，每次0.5-1g；蝎尾用量为全蝎的1/3。外用：研末掺、熬膏或油浸涂敷。,血虚生风者及孕妇禁服。
杨树花,味苦，性寒。归大肠经,无毒,清热解毒，化湿止痢。,细菌性痢疾，肠炎。,植物,内服：煎汤，9-15g。外用：适量，热熨。,脾胃虚寒者慎服。
徐长卿,鬼督邮、石下长卿、别仙踪、料刁竹、钓鱼竿、逍遥竹、一枝箭、英雄草、料吊、土细辛,味辛，性温；归肝、胃经,祛风除湿，行气活血，去痛止痒，解毒消肿。,1、风湿痹痛，脘腹疼痛，痛经，跌打伤痛及牙痛等症：徐长卿辛散温通，能祛邪而行气血，故有良好的止痛作用。  2、小便不利，泄泻，痢疾：徐长卿能除湿利水。  3、湿疹，风痒，顽癣：能祛风止痒，善治风淫湿侵所致的瘙痒性皮肤病。  4、毒蛇咬伤：徐长卿能解毒消肿。  5、晕车、晕船之头晕、恶心之症：徐长卿有镇静醒神和胃作用。 ,植物,内服：煎汤，3-10g，不宜久煎；研末，1-3g，或入丸剂，或浸酒。,体弱者慎服。
藿香,土藿香、猫把、青茎薄荷、排香草、大叶薄荷、绿荷荷、川藿香、苏藿香、野藿香、猫尾巴香、猫巴虎、拉拉香、八蒿、鱼香、鸡苏、水麻叶,味辛，性微温；归脾、胃、肺经,化湿，止呕，解暑。,1、湿阻中焦：本品气味芳香，为芳香化湿浊要药。  2、呕吐：本品既能化湿，又能和中止呕。  3、暑湿或湿温初起：本品既能化湿，又可解暑。  4、西医诊为慢性胃肠炎属于湿阻中焦者，胃肠神经官能症、胃肠型感冒、急性胃肠炎属于暑湿表证者。,植物,内服：煎服，5-10g。鲜品加倍。,不宜久煎，阴虚火旺者禁服。
狼把草,乌阶、乌杷、郎耶草、小鬼叉、豆渣草、针包草，引线包、大狼把草，接力草、针线包、一包针,全国大部分地区,养阴润肺，厚肠止痢，解毒疗疮，清热利湿。,主要用于气管炎，肺结核，咽喉炎，扁桃体炎，痢疾，丹毒，癣疮。,味苦、甘，性平,内服：煎汤，6-15g（鲜者30-60g）；研末撒或捣汁。外用：研末指或捣汁涂。,内无湿热者不宜用。
烟草,野烟、淡把姑、担不归、金丝烟、相思草、返魂烟、仁草、八角草、烟酒、金丝醺、淡肉要、淡巴菰、鼻烟、水烟、烟草、菸草、贪极草、延命草、穿墙草、土烟草、金鸡脚下红、烟叶、土烟,味辛，性温。,行气止痛，燥湿，消肿，解毒杀虫。,食滞饱胀，气结疼痛，关节痹痛，痈疽，疔疮，疥癣，湿疹，毒蛇咬伤，扭挫伤。,有毒,内服：煎汤，鲜叶9-15；或点燃吸烟。外用：适量，煎水洗；或捣敷；或研末调敷。,气虚、阴虚者不宜燃吸。咳嗽、血证及一切喉证禁服。
合欢皮,合昏皮、夜合皮、合欢木皮,被子植物门,解郁安神，活血消肿。,主要用于心神不宁，忿怒忧郁，烦躁失眠，跌打损伤，筋断骨折，血瘀肿痛以及肺痈、疮痈肿毒等。 ,双子叶植物纲,内服：煎汤，10-15g；或入丸、散。外用：研末调敷。,1、味甘性平，功善解郁安神。心神不安、虚烦失眠等神志异常由痰热等其他因素所致者，须适当配伍，不宜单味药服用。
莪术,蓬莪茂、蓬药、蓬莪术、广茂、蓬术、青姜、羌七、广术、黑心姜、文术,味辛、苦，性温；归肝、脾经,行气破血，消积止痛。,用于血气心痛，饮食积滞，脘腹胀痛，血滞经闭，痛经，癥瘕痞块，跌打损伤。 ,植物,内服：煎汤，3-10g；或入丸、散。外用：适量，煎汤洗；或研末调敷。行气止痛多生用，破血祛瘀宜醋炒。,1、莪术破血力强，月经过多，孕妇忌用。
