药材,别名,性味归经,功用,症状,药材分类,用法用量,注意事项
水翁花,水香、酒翁、土槿皮,味苦、微甘，性凉。归肺，脾，胃经,清热解毒，祛暑生津，消滞利湿。,感冒发热，细菌性痢疾，急性胃肠炎，消化不良。,无毒,内服：煎汤，15-30g；泡水代茶；或煮粥。,脾胃虚寒者禁用。
河豚,赤鲑、鯸鮧鱼、鯸鲐、鲑鱼、鹕夷鱼、嗔鱼、吹肚鱼、鰗鮧、河鲀鱼、气泡鱼、胡夷鱼、气包鱼,味甘，性温；归肝、肾经,滋补肝肾，祛湿止痛。,阳痿，遗尿，眩晕，腰膝酸软，风湿痹痛，皮肤瘙痒。,有毒,内服：久煮食（2h以上），适量。,疮、疥、脚气患者慎服。河豚内脏及血有剧毒。食用时须去净睾丸、卵、肝等内脏，并应将肉反复洗涤。处理不当易引起中毒。河豚中毒发病迅速而症状严重，多在吃后10-15min发病。初见恶心呕吐、腹中不适、脸色苍白，继则口唇、舌体、上下肢麻木感、疼觉迟钝，渐至四肢运动麻痹、瘫痪、共济失调、语言障碍、视野不明、听力减弱，严重者大汗淋漓、体温及血压下降、脉搏细数微弱、呼吸浅表频数、瞳孔散大、全身呈青紫色，但神志往往清醒，心电图可见房室传导阻滞，超过8h未死亡者，一般可望恢复。
西南毛茛,味辛，性温。入肝、脾经,有毒,利湿消肿，止痛杀虫，截疟。,用于疟疾。,植物,外用：适量，捣敷患处或穴位。,
矮柳穿鱼,味苦，性寒,植物,清热利湿，解毒消肿。,湿热黄疸，丹毒，咽喉肿痛，口舌生疮。,,内服：煎汤，10-15g。,
羖羊角,味苦、咸，性寒；归肝、心经,动物,清热，镇惊，明目，解毒。,风热头痛，温病发热神昏，烦闷，吐血，小儿惊痫，惊悸，青盲内障，痈肿疮毒。,本词条仅用于中医药知识的科普，对于任何形式的野生动物和野生植物的使用均须遵守国家的相关法律法规。,内服：煎汤，9-30g；或烧存性研末。外用：适量，烧灰研末调敷。,
蟾皮,味苦，性凉,有毒,清热解毒，利水消胀。,痈疽，肿毒，瘰疬，湿疹，疳积腹胀，慢性气管炎。,动物,内服：煎汤，3-9g；或研末。外用：适量，鲜用敷贴；或干品研末调敷。,《饮片新参》：“表热及虚胀者忌用。”
白花蛇目睛,味甘、咸，性平,动物,疏风定惊。,小儿夜啼。,本词条仅用于中医药知识的科普，对于任何形式的野生动物和野生植物的使用均须遵守国家的相关法律法规。,内服：研末，每次少许冲服。,
玳瑁,瑇瑁、蝳瑁、瑇瑁甲、明玳瑁、文甲,味甘、咸，性寒；归心、肝经,,1、热病高热，神昏谵语抽搐，小儿惊风，中风不语：玳瑁入心肝二经，既可平肝定惊，又可清热解毒。 2、眩晕，心烦不眠：玳瑁味甘、咸，性寒，以清热平肝潜阳见功。 3、痘毒，疔疮痈肿：玳瑁有清热解毒作用。 4、西医诊为原发性高血压病、脑内出血、脑动脉阻塞、脑血栓、前庭系统疾病、脑肿瘤、脑动脉粥样硬化等属肝阳上亢，甚则肝风内动，蜂窝组织炎、血小板减少性紫癜、发热、毛囊炎等属热毒壅滞者。,动物,内服：煎汤，9-15g；或磨汁；亦可入丸、散。外用：适量，研末调涂。,虚寒证无火毒者禁服。
菠菜,菠棱、波棱菜、红根菜、赤根菜、波斯草、鹦鹉菜、鼠根菜、角菜、甜茶、拉筋菜、敏菜、飞薐菜、飞龙菜,味甘，性平。归肝、胃、大肠、小肠经,解热毒，通血脉，利肠胃。,用于头痛，目眩，目赤，夜盲症，消渴，便秘，痔疮。,植物,内服：适量，煮食；或捣汁饮。,
山黄豆藤,螃蟹眼睛、古眼风、三叶豆,湖北、广西、四川,祛风清热，定惊解毒。,风热感冒，咳嗽，小儿高热惊风，心悸，乳痈。,味苦、涩，性平。入心、肺经,内服：煎汤，3-9g。,无热者忌用。多服致哑。
夹蛇龟肉,味甘，性寒,有毒,滋补强壮，活血解毒。,体虚羸瘦，关节痛，跌打损伤，风湿痹痛，毒蛇咬伤。,动物,内服：煮食，适量。外用：适量，生捣敷。,
狗脑,狗脑髓,味甘、咸，性平,祛风止痛，解毒敛疮。,头风痹痛，下部（匿虫）疮，鼻中息肉，狂犬咬伤。,动物,内服：煎汤，半具至1具。外用：适量，捣敷。,
鹿皮,味咸，性温,动物,补气，涩精，敛疮。,白带，血崩不止，肾虚滑精，漏疮。,1、梅花鹿为国家一级保护动物，目前野生较少，禁止捕猎。2、马鹿为国家二级保护动物，野生者日渐减少，禁止滥捕。3、本词条仅用于中医药知识的科普，对于任何形式的野生动物和野生植物的使用均须遵守国家的相关法律法规。,内服：煎汤，9-12g。外用：适量，烧灰调涂。,
熊脂,味甘，性温；归脾经,动物,补虚损，润肌肤，消积，杀虫。,虚损羸瘦，风痹不仁，筋脉挛急，积聚，面疮，癣，白秃，臁疮。,本词条仅用于中医药知识的科普，对于任何形式的野生动物和野生植物的使用均须遵守国家的相关法律法规。,内服：和花椒熬炼后开水冲服，10-20g。外用：适量，涂搽。,
鳖胆,味苦，性寒,动物,解毒消肿。,痔漏。,1、山瑞鳖为国家二级保护动物，禁止滥捕。2、本词条仅用于中医药知识的科普，对于任何形式的野生动物和野生植物的使用均须遵守国家的相关法律法规。,外用：适量，涂敷。,
野猪皮,味甘，性平,动物,解毒生肌，托疮。,鼠瘘，恶疮，疥癣。,本词条仅用于中医药知识的科普，对于任何形式的野生动物和野生植物的使用均须遵守国家的相关法律法规。,内服：烧灰，研末冲，3-9g。外用：适量，烧灰调敷。,
鳖肉,味甘，性平；归肝、肾经,动物,滋阴补肾，清退虚热。,虚劳羸瘦，骨蒸痨热，久疟，久痢，崩漏，带下，癥瘕，瘰疬。,1、山瑞鳖为国家二级保护动物，禁止滥捕。2、本词条仅用于中医药知识的科普，对于任何形式的野生动物和野生植物的使用均须遵守国家的相关法律法规。,内服：煮食，250-500g；或入丸剂。,脾胃阳虚及孕妇慎服。
小果倒地铃,炮卜草、金丝苦楝、三角泡、三角藤、包袱草、倒地铃、粽仔草,我国东部、南部和西南部很常见，北部较少,清热利湿，消肿解毒。,用于黄疸，各种淋证，糖尿病，百日咳，咽喉炎，湿疹，对口疮，疮疔痈肿，跌打损伤。,味苦，性寒。归心、肺、脾经,内服：煎汤9-15g（鲜品30-60g）。外用：适量，捣敷；或煎水洗。,孕妇忌用。
血人参,木本胡枝子、白氏胡枝子、鯕山附子、三叶青、三头草、金腰带、三叶枝、山乌豆、知天文、鯕药、豆荚、女金丹、土附子、粘衣草,味辛、微苦，性平。归肺经,清热解表，化痰，利湿，活血止痛。,用于感冒发热，咳嗽，肺痈，小儿哮喘，淋证，黄疸，胃痛，胸痛，瘀血腹痛，风湿痹痛，崩漏，疔疮痈疽，丹毒。,植物,内服：煎汤，9-15g，鲜品30-60g；或炖肉。外用：适量，捣敷。,虚劳咳嗽及孕妇慎服。
梧桐花,味甘，性平,植物,利湿消肿，清热解毒。,水肿，小便不利，无名肿毒，创伤红肿，头癣，汤火伤。,,内服：煎汤，6-15g。外用：适量，研末调涂。,
鳖头,味甘、咸，性平,动物,补气助阳。,久痢，脱肛，产后子宫下垂，阴疮。,1、山瑞鳖为国家二级保护动物，禁止滥捕。2、本词条仅用于中医药知识的科普，对于任何形式的野生动物和野生植物的使用均须遵守国家的相关法律法规。,内服：焙研，3-6g；或入丸剂。外用：适量，烧灰研末敷。,脾胃虚寒、食减便溏及孕妇忌用。
狗齿,味甘、咸，性平,动物,镇痉，祛风，解毒。,癫痫，风痱，发背，痘疹。,本词条仅用于中医药知识的科普，对于任何形式的野生动物和野生植物的使用均须遵守国家的相关法律法规。,内服：磨汁或烧存性研末。外用：适量，烧存性研末调敷。,
白鹅膏,白鹅脂,味甘，性凉,润皮肤，解毒肿。,皮肤皲裂，耳聋聤耳，噎膈反胃，药物中毒，痈肿，疥癣。,动物,内服：煮食，适量。外用：适量，涂敷。,
八目鳗,七星子鱼、七鳃鳗、七星鱼、七星鳗,味甘，性温,滋补强壮，通经活络，明目。,口眼歪斜，夜盲症，角膜干燥。,动物,内服：煮食，1-2条。外用：适量，鲜品捣敷。,
水翁叶,味苦，性寒。归肝经,植物,清热消滞，解毒杀虫，燥湿止痒。,用于湿热泻痢，食积腹胀，乳痈，湿疮，脚气，疥癞，皮肤瘙痒，刀、枪伤。,,内服：煎汤，6-15g。外用：适量，捣敷或煎汤洗。,
蚌泪,方诸水、活蚌水、蚌水、蚌清水,味甘，性寒,止渴，明目，清热解毒。,消渴，赤眼，烫伤，鼻疔。,动物,内服：适量，炖。外用：适量，涂敷或点眼。,
葎草花,味甘，性微寒；归肺经,植物,滋阴润肺。,阴虚内热，干咳少痰，骨蒸汗出等症。,,9-18g；或研末。,
马尾连,马尾黄连,全国各地多有分布，西北、西南及东北较多,清热燥湿，泻火解毒。,1、湿热泻痢，黄疸：本品性味苦寒，善于清热燥湿，功似黄连。  2、热病烦躁：本品苦寒入心，能泻心火以除烦。  3、肺热咳嗽：取本品入肺经而泻肺火。  4、痈疮肿毒，目赤肿痛：《内经▪素问》谓“诸痛痒疮，皆属于心”，本品入心经而泻心火。  5、西医诊为细菌性痢疾、急慢性肠炎属于大肠湿热者，黄疸属于肝胆湿热者，湿疹属于湿热内蕴者，急性结膜炎等属于肝火上炎者。,味苦，性寒；归心、肺、肝、胆、大肠经,内服：煎服，6-12g。全草15-30g。,脾胃虚寒者慎用。
水苏,鸡苏、劳祖、芥蒩、龙脑薄荷、香苏、芥苴、野紫苏、朋头草、山升麻、乌雷公、陈痧草、水鸡苏,味辛，性凉；归肺、胃经,清热解毒，止咳利咽，止血消肿。,感冒，痧症，肺痿，肺痈，头风目眩，咽痛，失音，吐血，咯血，衄血，崩漏，痢疾，淋证，跌打肿痛。,植物,内服：煎汤，9-15g。外用：适量，煎汤洗；或研末撒；或捣敷。,体虚者慎用。
茴香虫,味辛、甘，性温；归肝、胃经,动物,理气，化瘀，止痛。,胃脘痛，疝气腹痛，呃逆，噎膈。,本词条仅用于中医药知识的科普，对于任何形式的野生动物和野生植物的使用均须遵守国家的相关法律法规。,内服：研末，1.5-3g；或1-3条。,《四川中药志》1960年版：“胃有热及体虚者忌服。”
顶果膜蕨,味微涩，性平,无毒,止血生肌。,外伤出血。,植物,外用：适量，鲜品捣敷；或研末敷。,
蟾头,味辛、苦，性凉,有毒,消疳散积。,小儿疳积。,动物,内服：适量，入丸、散。,
鹿靥,味微咸，性温,动物,散结消瘿。,瘿瘤。,1、梅花鹿为国家一级保护动物，目前野生较少，禁止捕猎。2、马鹿为国家二级保护动物，野生者日渐减少，禁止滥捕。3、本词条仅用于中医药知识的科普，对于任何形式的野生动物和野生植物的使用均须遵守国家的相关法律法规。,内服：酒浸，适量。,
钻天杨,我国长江及黄河流域,味苦，性寒；归肝、心经,凉血解毒，祛风除湿。,感冒，肝炎，痢疾，风湿疼痛，脚气肿，烧烫伤，疥癣秃疮。,植物,内服：煎汤，10-30g；或泡酒。外用：适量，烧炭研末调搽；或熬膏涂。,尚不明确。
羊胆,味苦，性寒；归肝、胆经,动物,清热解毒，明目退翳，止咳。,目赤肿痛，青盲夜盲，翳障，肺痨咳嗽，小儿热惊，咽喉肿痛，黄疸，痢疾，便秘，热毒疮疡。,本词条仅用于中医药知识的科普，对于任何形式的野生动物和野生植物的使用均须遵守国家的相关法律法规。,内服：熬膏或干燥研末，0.3-0.6g；或入丸、散。外用：适量，涂敷、点眼或灌肠。,《四川中药志》1962年版：“凡体虚无湿热者忌用。”
霸王鞭,金刚杵、冷水金丹、金刚纂、刺金刚,味苦涩,祛风解毒，杀虫止痒。,疮毒，皮癣，水肿。,植物,外用：取浆汁搽涂患处。,
霸王根,味辛，性温。归胃经。,植物,行气宽中。,气滞腹胀。,,3-6g。,
田唇乌蝇翼,水老虎、水百足、黄花儿《广西药用植物名录》,味微苦，性平。入肺经,解毒消肿，止咳。,钩端螺旋体病，痈肿疮毒，毒蛇咬伤，咳嗽。,植物,内服：煎汤，15-30g，鲜品60-120g。外用：适量，鲜品捣敷。,
狼紫草,野旱烟,华北、西北,解毒，消炎止痛。,疮肿。,味辛，性温，归肝经,外用：适量，叶捣烂敷患处。,尚不明确。
鸐雉,翟、山雉、翟鸡、山鸡、鸐鸟,味甘，性平。归脾、肺经,补中益气，平喘。,用于气虚喘促，体虚乏力。,小毒,内服：煮食，100-200g；或炙食。,《食疗本草》：“食之发五痔。和荞麦面食之生肥虫。”
蟾舌,味辛、苦、甘，性凉,动物,解毒拔疔。,疔疮。,本词条仅用于中医药知识的科普，对于任何形式的野生动物和野生植物的使用均须遵守国家的相关法律法规。,外用：适量，研烂摊贴患处。,
羊脬,羊胞,味甘，性温,缩小便。,下焦气虚，尿频遗尿。,动物,内服：炙食，1个；或焙干研末酒冲，9-15g。,
狗乳汁,味甘，性平,动物,明目，生发。,青盲，脱发。,本词条仅用于中医药知识的科普，对于任何形式的野生动物和野生植物的使用均须遵守国家的相关法律法规。,内服：酒冲，适量。外用：适量，涂敷。,
鹿尾,味甘、咸，性温,动物,补肾阳，益精气的。,肾虚遗精，腰脊疼痛，头昏耳鸣。,1、梅花鹿为国家一级保护动物，目前野生较少，禁止捕猎。2、马鹿为国家二级保护动物，野生者日渐减少，禁止滥捕。3、本词条仅用于中医药知识的科普，对于任何形式的野生动物和野生植物的使用均须遵守国家的相关法律法规。,内服：煎汤，6-15g；或入丸剂。,阳盛有热者禁服。
光梗丝石竹,微甘、辛，平,植物,止咳，化痰。,用于咳嗽。,,内服：煎汤，6-9g。,
桃花,味苦，性平；归心、肝、大肠经,植物,利水通便，活血化瘀。,小便不利，水肿，痰饮，脚气，砂石淋，便秘，癥瘕，闭经，癫狂，疮疹，面䵟。,,内服：煎汤，3-6g；研末，1.5g。外用：适量，捣敷；或研末调敷。,不宜久服、孕妇禁服。
万年柏,虎尾蕨，深裂铁角蕨，地柏枝，洞里仙《全国中草药汇编》,味苦、甘，性凉。入肺、肝、胃经,清热解毒，平肝镇惊，止痛。,肝炎，小儿惊风，牙痛，毒蛇咬伤。,植物,内服：水煎服，15-30g。外用：适量，捣敷；清热生用；止血炒用。,
云南柴桂,味辛、涩，性温。归肺、肝经,植物,祛风活络，散寒止痛，止血。,用于风寒感冒，胃寒痛，风湿痹痛，跌打损伤疼痛，外伤出血。,,3-9g，水煎或研粉，酒送服；或泡酒服。外用：适量，干叶研粉敷患处。,
狗毛,辛、咸，平；归心、干警,动物,截疟，敛疮。,疟疾，烧烫伤。,本词条仅用于中医药知识的科普，对于任何形式的野生动物和野生植物的使用均须遵守国家的相关法律法规。,内服：烧存性研末，3g。外用：适量，烧存性研末调敷。,
鳖卵,味咸，性寒,动物,补阴，止痢。,小儿久泻久痢。,1、山瑞鳖为国家二级保护动物，禁止滥捕。2、本词条仅用于中医药知识的科普，对于任何形式的野生动物和野生植物的使用均须遵守国家的相关法律法规。,内服：煮食，2-6个。,
山黄菊,旋伏花、金菊花,福建、广东、广西、云南,清热，化痰。,感冒发热，肺热咳嗽，咽喉痛。,味苦，性凉。入肺经,内服：煎汤，5-10g。,尚不明确。
鹿胎,味甘、咸，性温,动物,温肾壮阳，补血生精，调经止血。,肾阳亏损，精血不足，腰膝酸软，劳瘵，月经不调，宫寒不孕，崩漏带下。,1、梅花鹿为国家一级保护动物，目前野生较少，禁止捕猎。2、马鹿为国家二级保护动物，野生者日渐减少，禁止滥捕。3、本词条仅用于中医药知识的科普，对于任何形式的野生动物和野生植物的使用均须遵守国家的相关法律法规。,内服：入丸、散，6-15g；鲜品可煮汁熬膏。,上焦有痰热及胃中有火者忌用。
蚌粉,蚌蛤灰、蜃灰、蚌壳粉、蚌壳灰,味咸，性寒；归肺、肝、胃经,化痰消积，清热燥湿。,痰饮咳嗽，呕逆，疳积，白带，湿疹，痱子，烫伤。,动物,内服：入丸、散，3-6g。外用：适量，干糁；或调敷。,《本草汇言》：“诸病属脾肺虚寒而无火者，须禁用之。”
西南山茶,山茶花、茶花、红山茶花、四棱标,味微辛、苦、涩，性平。归肝、脾经,解毒消炎，收敛止痢，活血止血，调经。,用于痢疾，肠风下血，急性胃肠炎，月经不调，鼻衄，吐血，风湿痹痛，关节炎，脱肛，烧烫伤。,植物,花、根15-30g；叶3g研粉，温酒调服。外用：适量，研末调敷或干掺。,《云南中草药》：“忌酸冷。”
大花列当,味涩、微甘，性温,无毒（《青藏高原药物图鉴》）,止血。,用于妇女崩漏，鼻衄。,植物,内服：煎汤，6-15g。,
塘虱鱼,角鱼、暗钉鱼、须手鲇、胡子鲶、土虱、塘角鱼,味甘，性平；归肾、肺、胃经,益肾，调中，养血，止血。,久病体虚，腰膝酸痛，小儿疳积，哮喘，衄血，倒经。,动物,内服：煮食，100-200g。,
熊骨,味咸、微辛，性温,动物,祛风，除湿，定惊。,风湿骨节肿痛，小儿惊风。,本词条仅用于中医药知识的科普，对于任何形式的野生动物和野生植物的使用均须遵守国家的相关法律法规。,内服：煎汤，15-30g；或浸酒。外用：适量，煎汤洗。用时捣碎。,
碗蕨,贯众（广西）,味辛，性凉。入膀胱经,祛风，清热解表。,感冒头痛，风湿痹痛。,植物,内服：煎汤，9-15g。,
跌打草,细穗爵床、盗偷草,味辛，性平。 归心、肝经,散瘀消肿，接骨止血。,跌打肿痛，骨折，外伤出血。,无毒,内服：煎汤，15-30g。外用：适量，捣敷。,
白花蛇头,味甘、咸，性温,有毒,祛风，定惊。,小儿惊风，紫癜风，疥癣，麻风。,动物,内服：入丸、散。外用：适量，研末调敷。,
熊掌,味甘，性平；归脾、胃经,动物,健脾胃，补气血，祛风湿。,脾胃虚弱，诸虚劳损，风寒湿痹。,本词条仅用于中医药知识的科普，对于任何形式的野生动物和野生植物的使用均须遵守国家的相关法律法规。,内服：煮食，30-60g。,
满山红根,RhododendrondauricumL.,黑龙江、吉林、内蒙古,止痢。,肠炎，痢疾。,味辛、微甘，性寒，归肺经,9-15g。,尚不明确。
水翁皮,味苦、辛，性凉。归肝、肺经,植物,清热解毒，燥湿，杀虫。,用于脚气湿烂，湿疹，疥癣，疳疮，肾囊痈，烧烫伤。,,外用：适量，捣敷；煎汤熏洗；或煎汁涂。,孕妇慎用。
东川蒿,东川蒿、小亮苞蒿,味甘、淡，性寒。归脾、肝、膀胱经,除湿热，散风解郁，发汗利湿。,湿热蕴脾证，风热外感证，外有表证，内停水湿。,无毒,6-9g。外用适量。,
鼺鼠,耳鼠、鼯鼠、夷由、飞鼠、飞生、飞生虫、飞生鸟、飞虎、松猫儿、大鼯鼠,味甘，性温,催产，止痛。,难产，产后腰痛，关节痛，头风痛。,动物,内服：泡酒服，15-30g。,《广西药用动物》：“血虚无瘀滞的人忌用，孕妇慎用。”
大黄蜂子,露蜂房子,味甘，性凉；归心、脾经,行气止痛，健脾止呕。,胸腹胀痛，干呕。,有小毒,内服：煎汤或研末。,
山花生,狗尾花、细叶假花生（《南宁市药物志》），中蝶草、木假地豆、通乳草（《广西药用植物名录》），大叶青（《全国中草药汇编》），小槐花、木本山土豆（《台湾药用植物志》），狗屎豆（福建），假花生、野花生、铁马,浙江、福建、台湾、广西、广东、四川、贵州和云南等省区,清热，利尿，解毒。,肺热咳喘，水肿，淋证，尿血，跌打肿痛，毒蛇咬伤，痈疖，暑温，痄腮。,味甘、微苦，性寒,内服：煎汤，15-60g。外用：适量，鲜品捣敷。,脾胃虚寒者慎用。
鲃鱼,青竹、青鱼、竹鲃、青竹鲤、青鲋鲤,味甘，性热,补肾阳，壮腰膝。,肾虚阳萎，腰膝酸软。,小毒,内服：煮食，50-100g；或晒干研末，入丸、散。,热证、阴血不足者慎服。
慈乌胆,味苦，性凉；归肝经,动物,明目解毒。,烂弦风眼，翳障，藤黄中毒。,本词条仅用于中医药知识的科普，对于任何形式的野生动物和野生植物的使用均须遵守国家的相关法律法规。,外用：适量，点眼。内服：适量，兑酒。,
熊脑,味咸，性温,动物,补虚祛风。,眩晕，耳鸣耳聋，白秃风屑。,本词条仅用于中医药知识的科普，对于任何形式的野生动物和野生植物的使用均须遵守国家的相关法律法规。,内服：煮汤，15-30g。外用：适量，涂搽。,
墨七,活血莲、凉水渣子、血散七、龙胡子、土莎莲（四川）、一口血、独儿七、笋尖七（湖北）,味辛、苦，性温,活血调经，散瘀止痛。,月经不调，跌打损伤，骨折疼痛，风湿性关节痛，胃痛，无名肿毒。,小毒,内服：煎汤，9-15g；或泡酒。外用：适量，磨涂。,
水麻䒒,藏氏蓼、凹叶蓼、水犁壁草、火烫草、拉拉草、红降龙草（湖北）,味苦、辛，性寒,祛风清热，活血止痛。,风热头痛，咳嗽，痧疹，痢疾，跌打伤痛，干血痨。,植物,内服：煎汤，9-15g。外用：适量，研末调敷。,
鹿蹄肉,味甘，性平；归肝、肾经,动物,补虚祛风，除湿止痛。,风寒湿痹，腰脚酸痛。,1、梅花鹿为国家一级保护动物，目前野生较少，禁止捕猎。2、马鹿为国家二级保护动物，野生者日渐减少，禁止滥捕。3、本词条仅用于中医药知识的科普，对于任何形式的野生动物和野生植物的使用均须遵守国家的相关法律法规。,内服：煮食，适量。,
满山红,映山红、迎山红、山崩子、靠山红、达子香、金达来、东北满山红,味苦，性寒；归肺经,止咳祛痰平喘。,咳喘痰多：本品味苦性寒，有较好的祛痰止咳作用，但平喘作用较弱。,有小毒,内服：煎汤，15-30g；或浸酒。,尚不明确。
檵木根,檵花根、土降香,湖南、江西、福建、安徽、浙江,止血，活血，收敛固涩。,咯血，吐血，便血，外伤出血，崩漏，产后恶露不尽，风湿关节疼痛，跌打损伤，泄泻，痢疾，白带，脱肛。,味苦、涩，性微温；归肝、脾、大肠经,内服：煎汤，15-30g。外用：适量，研末敷。,本品剧毒，应在医师指导下服用，孕妇、心脏病、溃疡病患者及小儿忌用。
滇崖爬藤,爬树龙、三爪龙、三角枫、马龙头叶、飞蜈蚣,味辛，性温,散瘀消肿，续筋骨。,主治骨折，跌打损伤，疮疖红肿。,无毒,内服：9-15g，水煎服。外用：研末敷。,
赛莨菪,山烟、塘古特山莨菪,西藏、青海、四川,解痉活血止痛。,胃脘痛，胆绞痛，腹痛。,味苦，性温，归胃经,内服：煎汤，0.3-0.9克。,心脏病及心肌衰弱者忌服。
鳕鱼,鳘、大头鱼、大头腥、大口,味甘，性平。归肝、肠经,活血止痛，通便。,跌打骨折，外伤出血，便秘。,动物,内服：煮食，适量。外用：适量，研末，水调敷。,鳕鱼与腊肉同食会在肠胃中合成致癌物亚硝酸。
商陆,夜呼、当陆、章陆、白昌、章柳根、见肿消、山萝卜、水萝卜、白母鸡、长不老、牛萝卜、春牛头、湿萝卜、下山虎、牛大黄、狗头三七、金七娘、猪母耳、金鸡母,味苦；性寒,逐水消肿，通利二便；外用解毒散结。,用于水肿胀满，二便不通；外治痈肿疮毒。 ,有毒,内服：煎汤，3-10g；或入散剂。外用：捣敷。内服宜醋制或久蒸后用；外用宜生品。,1、体虚水肿慎服，孕妇忌服。
大叶青木香,味苦，性微寒,植物,行气止痛，排脓解毒。,用于气滞脘腹胀痛，风湿关节痛，骨关节结核，毒蛇咬伤。,,内服：煎汤，3-6g；或研末。外用：适量，研末酒调敷。,
蛞蝓,土蜗、附蜗、蜒蚰、托胎虫、蛞蜗、鼻涕虫、蜒蚰螺,味咸，性寒；归肝、肺、大肠经,祛风定惊，清热解毒，消肿止痛。,筋脉拘挛，惊痫，喘息，咽肿，喉痹，痈肿，丹毒，痰核，痔疮肿痛，脱肛。,动物,内服：焙干研末或研烂为丸，2-3条。外用：研末或捣敷，5-10条。,病非属实热者及脾胃虚寒者慎服。
