药材,别名,性味归经,功用,症状,药材分类,用法用量,注意事项
白鹇,鹎雉、白鹎、白雉、越禽、银鸡、银雉,味甘，性平,补气，健脾，益肺。,脾胃虚弱，食欲不振，食后饱胀，大便溏泄，虚劳发热，咳嗽。,无毒,内服：水煮，50-100g，食肉饮汁。,
紫菀,青菀、紫葥、返魂草根、夜牵牛、紫菀茸、关公须,味苦、辛、甘，性微温；归肺经,润肺化痰止咳。,主要用于咳嗽有痰、肺痈、胸痹及小便不通等。 ,植物,内服：煎汤，4.5-10g；或入丸、散。,阴虚干咳者慎服。
断肠草,胡蔓藤、狗闹花、大炮叶、大茶药、钩吻、娥篓亮（布朗族名）、娥罗冷（傣族名）、奢树（基诺族名）、纳窝补（拉祜族名）、爪朵留（苗族名）,全株：味辛、苦，性温；根：味苦、辛，性温,全株：祛瘀除湿，活血散瘀，杀虫止痒。,1、全株：皮肤湿疹，恶疮肿毒，顽癣，跌打损伤，骨折瘀肿，风湿关节炎。 2、根：风湿骨痛，疮疖，搽癣。 3、叶：关节炎。,有大毒,外用适量。泡酒或煎水外搽，或粗粉加猪油外搽。,此药只能外用。
香薷,香菜、香葇、香戎、石香葇、石香薷、香茸、紫花香薷、蜜蜂草、香薷草、细叶香薷、小香薷、小叶香薷、香草、满山香、青香薷,味辛，性微温；归肺、脾、胃经,发汗解表，化湿和中，利水消肿。,1、风寒感冒：本品辛温发散，入肺经能发汗解表而散寒；其气芳香，入脾胃又能化湿和中而祛暑，多用于风寒感冒而兼脾胃湿困。  2、水肿脚气：本品辛散温通，外能发汗以散肌表之水湿，又能宣肺气启上源，通畅水道，以利尿退肿，多用于水肿而有表证者。,植物,内服：煎汤，3-9g。用于发表，量不宜过大，且不宜久煎；用于利水消肿，量宜稍大，且须浓煎。,1、性温，凡外感风热或温热、实热内炽、阴虚火旺等证不宜单味药长期服用。
紫参,石见穿、石打穿、月下红,味苦、辛，性平；归肝、脾经,活血化瘀，清热利湿，散结消肿。,月经不调，痛经，经闭，崩漏，便血，湿热黄疸，热毒血痢，淋痛，带下，风湿骨痛，瘰疬，疮肿，乳痈，带状疱疹，麻风，跌打伤肿。,植物,内服：煎汤，6-15g；或绞汁。外用：适量，捣敷。,
乌梅,梅实、熏梅、桔梅肉、梅、春梅,味酸、涩，性平；归肝、脾、肺、大肠经,敛肺止咳，涩肠止泻，安蛔止痛，生津止渴。,1、肺虚久咳：本品味酸而涩，其性收敛，入肺经能敛肺气，止咳嗽。  2、久泻，久痢：本品酸涩入大肠经，有良好的涩肠止泻痢作用，为治疗久泻、久痢之常用药。  3、蛔厥腹痛，呕吐：蛔得酸则静，本品极酸，具有安蛔止痛，和胃止呕的功效，为安蛔之良药。  4、虚热消渴：本品至酸性平，善能生津液，止烦渴。  5、本品炒炭后，涩重于酸，收敛力强，能固冲止漏，可用于崩漏不止，便血等；外敷能消疮毒，可治胬肉外突、头疮等。,植物,内服：煎服，3-10g，大剂量可用至30g。外用：适量，捣烂或炒炭研末外敷。止泻止血宜炒炭用。,不宜多食久食。
蛇菰,角菌、铺地开花《全国中草药汇编》,味苦、涩，性寒,清热解毒，凉血止血。,咳嗽吐血，血崩，痔疮肿痛，指疔。,植物,内服：9-18g。外用：适量，捣烂敷患处。,脾胃虚寒者禁服。
灯笼果,狗葡萄、醋栗、山樱桃,味辛，性温,解表。,用于感冒。,植物,内服：煎汤，9-15g。,
贝母,Fritillaria spp.,全国多地均有分布,川贝母：清热润肺、化痰止咳、散结消痈。,川贝母：用于肺热燥咳、干咳少痰、阴虚劳嗽、痰中带血、瘰疬、乳痈、肺痈。,味苦、甘，性微寒，归肺、心经,川贝母：3-10g；研粉冲服，一次1-2g。,川贝母：尚不明确。
七星鱼,乌棒鱼、张公鱼、花财鱼、花鲤鱼,味甘，性微温,滋阴、壮筋骨。,阴虚，四肢无力。,动物,内服：煮食，100-200g。,
青黛,靛花、青蛤粉、青缸花、蓝露、淀花、靛沫花,味咸，性寒；归肝、肺经,清热解毒，凉血消斑，清肝泻火，定惊。,1、温毒发斑，血热吐衄：本品寒能清热，咸以入血，故有清热解毒，凉血，止血，消斑之效。  2、咽痛口疮，火毒疮疡：本品有清热解毒，凉血消肿之效。  3、咳嗽胸痛，痰中带血：本品咸寒，主清肝火，又泻肺热，且能凉血止血。  4、暑热惊痫，惊风抽搐：本品咸寒，善清肝火，祛暑热，有息风止痉之功。 ,植物,内服1.5-3g。本品难溶于水，一般作散剂冲服，或入丸剂服用。外用：适量。,胃寒者慎用。
隔山消,隔山牛皮消、隔山撬、白首乌、白何首乌、山瓜蒌,味甘、苦，性平；归脾、胃、肝经,消食健胃，理气止痛。,脾虚食少、消化不良、脾胃气滞、脘腹胀痛、痢疾等。 ,植物,内服：煎汤，9-15g；外用：鲜品适量，捣敷。,过量服用易引起中毒。
龙胆草,陵游、草龙胆、龙胆、山龙胆、苦龙胆草、地胆草、胆草、四叶胆,味苦，性寒。归肺、肝经,清热燥湿，泻肝胆火。,用于清热燥湿，泻肝胆火。用于湿热黄疸，阴肿阴痒，带下，湿疹瘙痒，肝火目赤，耳鸣耳聋，胁痛口苦，强中，惊风抽搐。,植物,3-6g。,
空青,杨梅青,味甘、酸，性寒；归肝经,凉肝清热，明目去翳，活血利窍。,目赤肿痛，青盲，雀目，翳膜内障，中风口㖞，手臂不仁，头风，耳聋。,小毒,外用：研细，水飞，点眼。内服：研末，每次0.3-1g；或入丸、散。,内服宜慎。不宜多服、久服。
野荔枝,味涩、苦，性平。归肝、脾、大肠经,植物,清热解毒，收敛止血。,用于痢疾，外伤出血，骨折。,,内服：煎汤，9-15g。外用：适量，鲜品捣敷；或研末调敷。,
泽兰,虎兰、龙枣、小泽兰、虎蒲、地瓜儿苗、红梗草、风药、蛇王草、蛇王菊、捕斗蛇草、地环秧、地溜秧、甘露秧、草泽兰、麻泽兰、矮地瓜儿苗,味苦、辛，性微温；归肝、脾经,活血调经，祛瘀消痈，利水消肿。,主治月经不调，经闭，痛经，产后瘀血腹痛，疮痈肿毒，水肿腹水。,植物,内服：煎服，10-15g。外用：适量。,无瘀滞者慎用。
鸡子,鸡卵，鸡蛋,味甘、性平,滋阴润燥，养血安胎。,热病烦闷，燥咳声哑，目赤咽痛，胎动不安，产后口渴，小儿疳痢，疟疾，烫伤，皮肤瘙痒，虚人羸弱。,动物,内服：煮、炒，1-3枚；或生服；或沸水冲；或入丸剂。外用：取黄、白调敷。,1、孟诜：鸡子动风气，不可多食。
天山雪莲,雪荷花,味微苦，性温,有温肾助阳，祛风胜湿，通经活血的作用。,用于风寒湿痹痛、类风湿性关节炎、小腹冷痛、月经不调。,植物,3-6g，水煎或酒浸服。外用适量。,
海螵蛸,乌鲗骨、乌贼鱼骨、乌贼骨、墨鱼骨、墨鱼盖,味咸、涩，性微温；归肝、肾经,收敛止血，涩精止带，制酸止痛，收湿敛疮。,主要用于肾失固藏而遗精滑精，肝肾不足，任带受损或脾虚湿聚，带脉失约而致带下清稀量多，冲任失摄，崩漏下血，脾胃虚寒，胃痛吐酸，湿疮湿疹，溃疡不敛等。,动物,内服：煎汤，10-30g；研末，1.5-3g。外用：研末撒；或调敷；或吹耳、鼻。,阴虚多热者不宜多服；久服易致便秘，可适当配润肠药同用。
乌灵参,乌苓参、雷震子《灌县志》，乌丽参、鸡（土从）蛋《四川中药材标准》，地炭棍、鸡茯苓（刘波《中国药用真菌》）,味甘，性平。入心、肝经,安神，止血，降血压。,失眠，心悸，吐血，衄血，高血压病，烫伤。,植物,内服：煎汤，3-10g。外用：适量，研末，麻油调敷。,孕妇忌用。
代赭石,须丸、赤土、丁头代赭、血师、紫朱、赭石、土朱、铁朱、钉头赭石、钉赭石、赤赭石,味苦，性寒；归肝、心经,平肝潜阳，重镇降逆，凉血止血。,1、肝阳上亢，头晕目眩：本品为矿石类药物，质重沉降，长于镇潜肝阳；又性味苦寒，善清肝火，故为重镇潜阳常用之品。  2、呕吐，呃逆，噫气：本品质重性降，为重镇降逆要药。  3、气逆喘息：本品重镇降逆，能降上逆之肺气而平喘。  4、血热吐衄，崩漏：本品苦寒，入心肝血分，有凉血止血之效。,矿物,内服：煎服，10-30g；宜打碎先煎。入丸、散，每次1-3g。外用：适量。降逆、平肝宜生用，止血宜煅用。,虚寒证及孕妇慎服。
啄木鸟,斫木、山啄木、火老鸦,味甘，性平；归肝、脾经,滋养补虚，消肿止痛。,肺结核，小儿疳积，痔疮肿痛，龋齿牙痛。,动物,内服：煎汤，1只；或煅研，5-10g。外用：适量，煅末纳龋孔中。,
白芥子,辣菜子,被子植物门,温肺化痰，利气，散结消肿。,1、主要用于寒痰喘咳，悬饮，阴疽流注，肢体麻木，关节肿痛。 2、西医诊为急慢性支气管炎、支气管哮喘、渗出性胸膜炎、结核性胸膜炎、感冒、急慢性鼻炎属于寒痰停饮者，风湿性关节炎、化脓性骨髓炎、淋巴结肿大等属于痰湿阻滞者。,双子叶植物纲,内服：煎汤，3-10g；或入丸、散。外用：研末调敷；穴位敷贴。,1、辛温走散，耗气伤阴，久咳肺虚及阴虚火旺者忌用。
雪莲花,雪莲、雪荷花、大拇花、大木花,被子植物门,祛风湿，强筋骨，补肾阳，调经止血。,1、主要用于风湿痹证，经闭痛经，崩漏带下，阳痿等。 2、西医诊为风湿、类风湿性关节炎、腰肌蒡损、骨质增生属风寒湿邪闭阻型，妇女月经不调、妇科炎症属寒凝者，男性性功能紊乱属肾阳亏虚型。,双子叶植物纲,内服：煎汤，6-12g或浸酒。外用：捣敷。,用量不宜过大，孕妇禁服。
广藿香,藿香、海藿香,味辛，性微温；归脾、胃、肺经,芳香化湿，和胃止呕，祛暑解表。,1、湿阻中焦证：藿香芳香醒脾，运化湿浊，为治疗湿阻中焦证的常用药物。  2、呕吐：藿香微温而不燥烈，无论寒、热、虚、实的呕吐皆可应用，然其芳香化湿，和胃止呕，故对脾胃湿浊引起的呕吐尤为适宜。  3、暑湿感冒及湿温初起：藿香化湿和中，又能祛暑解表。  4、鼻渊、鼻流浊涕、不闻香臭：藿香辛散化浊以通鼻窍。,植物,内服：煎汤，5-10g，鲜者加倍，不宜久煎；或入丸、散。外用：适量，煎水含漱，或浸泡患部；或研末调敷。藿香叶偏于解表，藿香梗偏于和中止呕。,阴虚者禁服。
鹿茸,斑龙珠,味甘、咸，性温；归肾、肝经,补肾阳，益精血，强筋骨，调冲任，托疮毒。,1、肾阳虚衰，精血不足证：本品甘温补阳，甘咸滋肾，禀纯阳之性，具生发之气，故能壮肾阳，益精血。  2、肾虚骨弱，腰膝无力或小儿五迟：本品补肾阳，益精血，强筋骨。  3、妇女冲任虚寒，崩漏带下：本品补肾阳，益精血而兼能固冲任，止带下。  4、疮疡久溃不敛，阴疽疮肿内陷不起：本品补阳气、益精血而达到温补内托的目的。,动物,内服：1-2g，研末吞服；或入丸、散。,服用本品宜从小量开始，缓缓增加，不可骤用大量，以免阳升风动，头晕目赤，或伤阴动血。凡发热者均当忌服。
狗尾草,莠、莠草子、莠草、光明草、阿罗汉草、狗尾半支、大尾草、大尾曲、毛娃娃、毛嘟嘟、毛毛草,味甘、淡，性凉,清热利湿，祛风明目，解毒，杀虫。,风热感冒，黄疸，小儿疳积，痢疾，小便涩痛，目赤涩痛，目赤肿痛，痈肿，寻常疣，疮癣。,植物,内服：煎汤，6-12g，鲜品可用至30-60g。外用煎水洗或捣敷。,脾胃虚寒者慎服。
化州橘红,化州橘红、柚子皮,味辛、苦，性温。归肺、脾经,理气宽中，燥湿化痰。,用于咳嗽痰多，食积伤酒，呕恶痞闷。,植物,3～6g。,
赤石脂,赤符、红高岭、赤石土、吃油脂、红土,味甘、涩，性温；归大肠、胃经,涩肠止泻，收敛止血，敛疮生肌。,主要用于久泻久痢，大便出血，崩漏带下；外治疮疡久溃不敛，湿疮脓水浸淫。 ,矿物,内服：煎汤，10-15g，宜先煎去渣，取汁再入其他药煎煮；或入丸、散。外用：研末撒或调敷。,赤石脂性收涩，湿热积滞泻痢者忌服。孕妇应慎用。石脂畏官桂。
青果,谏果,味甘、酸，性平；归肺、胃经,清热解毒，利咽，生津。,1、咽喉肿痛，咳嗽烦渴：本品性平偏寒，功能清热解毒，生津利咽，化痰止咳。  2、鱼蟹中毒：本品甘平解毒。 ,植物,内服：煎服，4.5-9g；鲜品尤佳，可用至30-50g。,尚不明确。
竹黄,淡竹黄、竹三七、血三七、竹参、赤团子、竹赤团子、竹赤斑菌、淡菊花、天竹花、淡竹花、竹花、竹茧。,味淡，性平，归肺，肝经,化痰止咳，活血祛风，利湿。,用于咳嗽痰多，百日咳，带下，胃痛，风湿痹痛，小儿惊风，跌打损伤。,植物,内服：煎汤6-15g；或浸酒。外用：适量，酒浸敷。,《全国中草药汇编》：“孕妇及高血压患者禁服，服药期间忌食萝卜、酸辣。”
秦皮,岑皮、秦白皮、（木寻）木皮、蜡树皮,味苦、涩，性寒；归肝、胆、大肠经,清热燥湿，收涩止痢，止带，明目。,1、湿热泻痢，带下阴痒：本品性苦寒而收涩，功能清热燥湿、收涩止痢、止带。  2、肝热目赤肿痛，目生翳膜：本品清热之中，能泻肝火，明目退翳。 ,植物,内服：煎服，6-12g。外用：适量，煎洗患处。,脾胃虚寒者忌用。
透明草,玻璃草（广西）,味淡、涩，性凉。入心经,清热解毒。,痈疮肿痛，丹毒，无名肿痛，烧伤烫伤，毒蛇咬伤。,植物,内服：煎汤，5～15g。外用：适量，鲜全草，捣敷或绞汁涂。,
银耳,白木耳、白耳、桑鹅、五鼎芝、白耳子,味甘，性平；归肺、胃、肾经,滋阴润肺，养胃生津。,虚劳咳嗽，痰中带血，津少口渴，病后体虚，气短乏力。,植物,内服：煎汤，3-10g；或炖冰糖、肉类服。,近年来，市场上出现用硫黄熏白的银耳，食用后对人体有害，故不可食用。此外，银耳变质后受细菌污染产生毒素，食用后会中毒，严重者会导致肾功能衰竭、脑水肿等，以至死亡。
苏木,苏枋、苏方、苏方木、棕木、赤木、红柴、红苏木、落文树,味甘、咸、辛，性平；归心、肝经,活血祛瘀，消肿止痛。,主要用于跌打损伤，骨折筋伤，瘀滞肿痛，血滞经闭，产后瘀阻腹痛，痛经，心腹疼痛，痈肿疮毒。 ,植物,内服：煎服，3-10g。外用：适量，研末撒敷。,血虚无瘀滞者、月经过多者及孕妇禁服。
蜻蜓,负劳、蟌、蜻蛉、桑根、胡蝶、狐梨、诸乘、胡蜊、马大头、纱羊、蜻虰、青娘子、蝍蛉、仓螘。,味咸，性温。归肾经,益肾壮阳，强阴秘精。,用于肾虚阴痿，遗精，喘咳。,无毒（《日华子》）,内服：研末，3-6g；或入丸剂。,
白矾,矾石、羽涅、羽泽、理石、白君、明矾、雪矾、云母矾、生矾,味涩、酸，性寒；归肺脾、肝、大肠经,外用解毒杀虫，燥湿止痒；内服止血止泻，祛痰开闭。,主要用于疥癣、湿疹瘙痒、疮疡、久泻久痢、吐衄下血、中风痰厥、癫狂痫等。,有小毒,内服：研末，1-3g；或入丸、散。外用：适量，研末撒；或吹喉；或调敷；或化水洗漱。生用偏于解毒杀虫，煅枯用偏于收敛生肌。,本品味涩难服，内服不宜过量，易致呕吐；体虚胃弱者慎服。
太子参,童子参,味甘、苦，性平；归脾、肺经,补气生津，健脾益肺。,主要用于脾气虚弱，胃阴不足，热病后期，气阴两伤，阴虚肺燥，干咳少痰等。,植物,内服：煎汤，10-15g。,脾寒肠滑久泄者忌用。
淡豆豉,香豉、淡豉,味苦、辛，性凉；归肺、胃经,解表，除烦，宣发郁热。,1、外感表证：本品辛散轻浮，能疏散表邪，且发汗解表之力颇为平稳，无论风寒、风热表证，皆可配伍使用。  2、热病烦闷：本品辛散苦泄性凉，既能透散外邪，又能宣散邪热、除烦。,植物,内服：煎服，6-12g。,尚不明确。
蓖麻,红蓖麻、天麻子果、蓖麻子,种子、叶：为甘、辛，性平；根：味淡、微辛，性平,种子：消肿，排脓，拔毒。,种仁：子宫脱垂，脱肛，捣烂敷头顶百会穴；难产，胎盘不下，捣烂敷足心，涌泉穴；面神经麻痹，捣烂外敷，病左敷右，病右敷左，疮疡化脓未溃、淋巴结核，竹、木刺金属入肉，捣成膏状外敷。 种仁油：（榨油提纯蓖麻油）肠内积滞，大便秘结。用量10-20ml，顿服。 叶：疮疡肿毒，鲜品捣烂外敷；湿疹瘙痒，煎水外洗；灭蛆、杀孑孓，取叶或种仁外壳0.5kg，加水5kg，煎30分钟，药液按5%的比例放入污水或粪坑中。 根：风湿关节痛，破伤风，癫痫，精神分裂症。用量30-60g，水煎服。,种子有毒，叶有小毒,内服：根30-60g，水煎服。,
蟾蜍草,荔枝草、癞子草、癞蛤蟆草,味苦、辛，性凉；归肺、胃经,清热解毒，凉血散瘀，利水消肿。,本品主治感冒发热，咽喉肿痛，肺热咳嗽，咳血，吐血，尿血，崩漏，痔疮出血，肾炎水肿，白浊，痢疾痈肿疮毒，湿疹瘙痒，跌打损伤，蛇虫咬伤。,植物,内服：煎汤9-30g（鲜品15-60g），或捣绞汁饮。外用：捣敷，或绞汁含漱及滴耳，亦可煎水外洗。,孕妇慎用。
醋香附,Cyperi Rhizoma,广东、河南、四川、浙江、山东,疏肝止痛、消积化滞。,用于伤食腹痛、血中气滞、寒凝气滞、胃脘疼痛等。,味微苦，归肝经,内服：煎汤，5-10g；或入丸、散。,尚不明确。
白豆,饭豆、眉豆、白目豆、甘豆,味甘、咸，性平,补中益气，健脾益肾。,脾肾虚损，水肿。,植物,内服：煮食，90-150g。,
野菊花,野黄菊花、苦薏,味苦、辛，性微寒；归肝、心经,清热解毒。,1、痈疽疔疖，咽喉肿痛：本品辛散苦降，其清热泻火、解毒利咽、消肿止痛力胜，为治外科疔痈之良药。  2、目赤肿痛，头痛眩晕：本品味苦入肝，清泻肝火。  3、本品内服并煎汤外洗也用治湿疹、湿疮、风疹痒痛等。 ,植物,内服：煎服，10-15g。外用：适量。,尚不明确。
硫黄,石硫黄、石流黄、流黄、石留黄,味酸，性温；归肾、大肠经,外用解毒杀虫疗疮；内服补火助阳通便。,外治用于疥癣，秃疮，阴疽恶疮；内服用于阳痿足冷，虚喘冷哮，虚寒便秘。,有毒,内服：1.5-3g，炮制后入丸散服。外用：适量，研末油调涂敷患处。,孕妇慎用。不宜与芒硝、玄明粉同用。
甘蔗,藷蔗、薯蔗、干蔗、接肠草、竿蔗、糖梗,我国南方各地,清热生津，润燥和中，解毒。,用于烦热，消渴，呕哕反胃，虚热咳嗽，大便燥结，痈疽疮肿。,味甘，性寒，归肺、脾、胃经,内服：适量，30-90g；或榨汁饮。外用：适量，捣敷。,脾胃虚寒者慎服。
仙茅,地棕、独茅、山党参、海南参,味辛，性热；归肾、肝经,温肾壮阳，祛寒除湿。,主要用于阳痿精寒，遗尿尿频，寒湿痹痛，筋骨痿软，腹痛冷泻等。,有毒,内服：煎汤，3-10g；或入丸、散；或浸酒。外用：捣敷。,阴虚火旺者忌服。燥烈有毒，不宜久服。
黑豆,味甘，性平；归脾、肾经,植物,益精明目，养血祛风，利水，解毒。,阴虚烦渴，头晕目昏，体虚多汗，肾虚腰痛，水肿尿少，痹痛拘挛，手足麻木，药食中毒。,,内服：煎服，9-30g；外用适量。,尚不明确。
旱莲草,墨旱莲、金陵草、莲子草、旱莲草、旱莲子、白旱莲,菊目,滋补肝肾，凉血止血，祛湿止痒。,主治头晕目眩，须发早白，肾虚齿痛，吐衄咳血，尿血崩漏，阴痒，白浊，赤白带下等。,菊科,内服：煎汤，9-30g；或熬膏；或捣汁；或入丸、散。外用：捣敷；或捣绒塞鼻；或研末敷。,脾肾虚寒者忌服。
灶心土,伏龙肝、灶中黄土、釜下土、釜月下土、灶中土、灶内黄土,味辛，性温；归脾、胃经,,1、出血证：本品性温，能温暖中焦，收摄脾气而止血，为温经止血之要药。对脾气虚寒，不能统血之出血病证，皆可应用，尤其对吐血、便血的疗效更佳。 2、胃寒呕吐：本品性温质重，长于温中和胃而降逆止呕。主治脾胃虚寒，胃气不降所致的呕吐，与干姜、半夏、白术等同用，也可用治反胃、妊娠呕吐。 3、脾虚久泻：本品既能温脾暖胃，又能涩肠止泻，主治脾虚久泻，常配伍附子、干姜、白术等。若治胎前下痢，产后不止者，可以山楂、黑糖为丸，用本品煎汤代水送服，如伏龙肝汤（《张氏医通》）。 4、西医诊为上消化道出血、功能性子宫出血属脾胃虚寒、脾不统血，胃炎、溃疡性结肠炎、泄泻属脾胃虚寒者。,植物,内服：煎服，15-30g，布包，先煎；或60-120g，煎汤代水。亦可入丸、散，外用：适量。,
僵蚕,僵蚕、天虫、僵虫、白僵虫,味咸、辛，性平；归肝、肺、胃经,息风止痉，祛风止痛，化痰散结。,主要用于急慢惊风、癫痫、破伤风等出现的惊痫抽搐；风中经络，口眼歪斜；风热头痛，目赤，咽痛，风疹瘙痒；瘰疬痰核等。 ,动物,内服：煎服，3-10g。研末吞服，1-1.5g。或入丸、散剂。外用：研末撒或调敷。散风热多生用，余多炒用。,属于血虚而有风寒客邪者忌用。血小板减少、凝血机制障碍、有出血倾向者以及肝昏迷患者慎用。
南沙参,沙参、泡参、泡沙参,味甘，性微寒；归肺、胃经,养阴清肺，化痰，益气。,主要用于肺热燥咳、津伤口渴等。 ,植物,内服：煎汤，10-15g，鲜品15-30g，或入丸、散。,本品性凉，风寒咳嗽、脾胃虚寒及寒饮喘咳者宜慎用。
茺蔚子,益母子、冲玉子、益母草子、小胡麻,味甘、辛，性微寒；归肝经,活血调经，清肝明目。,1、妇女经产瘀血诸证：茺蔚子入肝经血分，善行瘀血、为妇科所常用。  2、肝经热盛，血逆于上，头痛头晕，心烦不宁。  3、肝热上攻，目赤肿痛。,小毒,内服：煎汤，6-9g；或入丸、散；或捣绞取汁。,茺蔚子有小毒，大量服用可发生中毒。
白及,甘根、连及草、白给、冰球子、白鸟儿头、地螺丝、羊角七、千年棕君求子、兜棕、白鸡儿、皲口药、利知子,味苦、甘、涩，性寒；归肺、胃、肝经,收敛止血，消肿生肌。,1、出血证：本品质粘味涩，为收敛止血之要药，可用治体内外诸出血证。因其主入肺、胃经，故临床尤多用于肺胃出血之证。  2、痈肿疮疡，手足皲裂，水火烫伤：本品寒凉苦泄，能消散血热之痈肿；味涩质粘，能敛疮生肌，为外疡消肿生肌的常用药。,植物,内服：煎服，3-10g；大剂量可用至30g；亦可入丸、散，入散剂，每次用2-5g；研末吞服，每次1.5-3g。外用：适量。,中药配伍禁忌：“十八反”中明言“乌头反白及”，故乌头（川乌，草乌）与白及一般不宜配伍。并反附子。
檵木叶,檵花叶,湖南、江西、福建、贵州、安徽、浙江、江苏、广东、广西、四川,收敛止血，清热解毒。,咯血，吐血，便血，崩漏，产后恶露不净，紫癜，暑热泻瘌，跌打损伤，创伤出血，肝热目赤，喉痛。,味苦、涩，性凉；归肝、胃、大肠经,内服：煎汤，15-30g；或捣汁。外用：适量，捣敷，研末敷，煎水洗或含漱。,脾胃虚寒者、孕妇、儿童慎用。
酒女贞子,冬青子、女贞实,味甘、苦，性凉。归肝、肾经。,滋补肝肾，清热明目。,主要用于腰膝酸痛，须发早白，阴虚内热，骨蒸劳热，盗汗遗精，头晕目眩，目暗不明，健忘耳鸣等。,植物,内服：煎汤，6-15g；或入丸剂。外用：敷膏点眼。,1、性偏寒凉，凡外感风寒、内伤生冷、脾胃虚寒、肾阳虚衰证等证不宜单味药大量长期服用。所含甘露醇有缓泻的作用，脾虚湿盛，大便滑泻，慢性肠炎，长期腹泻者不宜单味药大量长期服用。
蒲黄,蒲厘花粉、蒲花、蒲棒花粉、蒲草黄,味甘，性平；归肝、心包经,止血，化瘀，利尿。,用于吐血，衄血，咯血，崩漏，外伤出血，经闭痛经，胸腹刺痛，跌扑肿痛，血淋涩痛。,植物,内服：煎汤，5-10g，须包煎；或入丸散。外用：研末撒或调敷。散瘀止痛多生用，止血每炒用，血瘀出血；生熟各半。,孕妇慎服。
砗磲,车渠、海扇、蚵筋,味甘、咸，性寒,安神，解毒。,心神不安，失眠多梦，蜂虫螫伤。,动物,内服：磨粉，5-15g。,
